"id","title","overview","genres","director","cast"
372058,"Your Name.","High schoolers Mitsuha and Taki are complete strangers living separate lives. But one night, they suddenly switch places. Mitsuha wakes up in Taki’s body, and he in hers. This bizarre occurrence continues to happen randomly, and the two must adjust their lives around each other.","[""Animation"", ""Romance"", ""Drama""]","Makoto Shinkai","[""Ryunosuke Kamiki"", ""Mone Kamishiraishi"", ""Ryo Narita"", ""Aoi Yuki"", ""Nobunaga Shimazaki""]"
976573,"Elemental","In a city where fire, water, land and air residents live together, a fiery young woman and a go-with-the-flow guy will discover something elemental: how much they have in common.","[""Animation"", ""Comedy"", ""Family"", ""Fantasy"", ""Romance""]","Peter Sohn","[""Leah Lewis"", ""Mamoudou Athie"", ""Ronnie del Carmen"", ""Shila Ommi"", ""Wendi McLendon-Covey""]"
549509,"The Brutalist","When a visionary architect and his wife flee post-war Europe in 1947 to rebuild their legacy and witness the birth of modern United States, their lives are changed forever by a mysterious, wealthy client.","[""Drama""]","Brady Corbet","[""Adrien Brody"", ""Felicity Jones"", ""Guy Pearce"", ""Joe Alwyn"", ""Raffey Cassidy""]"
11036,"The Notebook","An epic love story centered around an older man who reads aloud to a woman with Alzheimer's. From a faded notebook, the old man's words bring to life the story about a couple who is separated by World War II, and is then passionately reunited, seven years later, after they have taken different paths.","[""Romance"", ""Drama""]","Nick Cassavetes","[""Ryan Gosling"", ""Rachel McAdams"", ""Gena Rowlands"", ""James Garner"", ""Joan Allen""]"
929590,"Civil War","In the near future, a group of war journalists attempt to survive while reporting the truth as the United States stands on the brink of civil war.","[""War"", ""Action"", ""Drama""]","Alex Garland","[""Kirsten Dunst"", ""Wagner Moura"", ""Cailee Spaeny"", ""Stephen McKinley Henderson"", ""Nelson Lee""]"
866398,"The Beekeeper","One man's campaign for vengeance takes on national stakes after he is revealed to be a former operative of a powerful and clandestine organization known as Beekeepers.","[""Action"", ""Crime"", ""Thriller""]","David Ayer","[""Jason Statham"", ""Emmy Raver-Lampman"", ""Josh Hutcherson"", ""Bobby Naderi"", ""Minnie Driver""]"
299534,"Avengers: Endgame","After the devastating events of Avengers: Infinity War, the universe is in ruins due to the efforts of the Mad Titan, Thanos. With the help of remaining allies, the Avengers must assemble once more in order to undo Thanos' actions and restore order to the universe once and for all, no matter what consequences may be in store.","[""Adventure"", ""Science Fiction"", ""Action""]","Anthony Russo","[""Robert Downey Jr."", ""Chris Evans"", ""Mark Ruffalo"", ""Chris Hemsworth"", ""Scarlett Johansson""]"
22,"Pirates of the Caribbean: The Curse of the Black Pearl","After Port Royal is attacked and pillaged by a mysterious pirate crew, capturing the governor's daughter Elizabeth Swann in the process, William Turner asks free-willing pirate Jack Sparrow to help him locate the crew's ship—The Black Pearl—so that he can rescue the woman he loves.","[""Adventure"", ""Fantasy"", ""Action""]","Gore Verbinski","[""Johnny Depp"", ""Geoffrey Rush"", ""Orlando Bloom"", ""Keira Knightley"", ""Jack Davenport""]"
575264,"Mission: Impossible - Dead Reckoning Part One","Ethan Hunt and his IMF team embark on their most dangerous mission yet: To track down a terrifying new weapon that threatens all of humanity before it falls into the wrong hands. With control of the future and the world's fate at stake and dark forces from Ethan's past closing in, a deadly race around the globe begins. Confronted by a mysterious, all-powerful enemy, Ethan must consider that nothing can matter more than his mission—not even the lives of those he cares about most.","[""Action"", ""Adventure""]","Christopher McQuarrie","[""Tom Cruise"", ""Hayley Atwell"", ""Ving Rhames"", ""Simon Pegg"", ""Rebecca Ferguson""]"
1185528,"Legends of the Condor Heroes: The Gallants","Under Genghis Khan, the Mongolian army pushes west to destroy the Jin Dynasty, setting its sights on the Song Dynasty next. Amid internal conflicts among martial arts schools, Guo Jing unites the Central Plains' warriors to defend Xiangyang, embodying courage and loyalty in the fight for the nation.","[""Action"", ""Drama"", ""History""]","Tsui Hark","[""Xiao Zhan"", ""Sabrina Zhuang"", ""Tony Leung Ka-Fai"", ""Zhang Wenxin"", ""Bayaertu""]"
769,"GoodFellas","The true story of Henry Hill, a half-Irish, half-Sicilian Brooklyn kid who is adopted by neighbourhood gangsters at an early age and climbs the ranks of a Mafia family under the guidance of Jimmy Conway.","[""Drama"", ""Crime""]","Martin Scorsese","[""Robert De Niro"", ""Ray Liotta"", ""Joe Pesci"", ""Lorraine Bracco"", ""Paul Sorvino""]"
769,"GoodFellas","The true story of Henry Hill, a half-Irish, half-Sicilian Brooklyn kid who is adopted by neighbourhood gangsters at an early age and climbs the ranks of a Mafia family under the guidance of Jimmy Conway.","[""Drama"", ""Crime""]","Martin Scorsese","[""Robert De Niro"", ""Ray Liotta"", ""Joe Pesci"", ""Lorraine Bracco"", ""Paul Sorvino""]"
1402,"The Pursuit of Happyness","A struggling salesman takes custody of his son as he's poised to begin a life-changing professional career.","[""Drama""]","Gabriele Muccino","[""Will Smith"", ""Jaden Smith"", ""Thandiwe Newton"", ""Brian Howe"", ""James Karen""]"
862,"Toy Story","Led by Woody, Andy's toys live happily in his room until Andy's birthday brings Buzz Lightyear onto the scene. Afraid of losing his place in Andy's heart, Woody plots against Buzz. But when circumstances separate Buzz and Woody from their owner, the duo eventually learns to put aside their differences.","[""Animation"", ""Adventure"", ""Family"", ""Comedy""]","John Lasseter","[""Tom Hanks"", ""Tim Allen"", ""Don Rickles"", ""Jim Varney"", ""Wallace Shawn""]"
483456,"Peacemaker Kurogane: Belief","Although traumatized by witnessing the murder of his parents by one of the Choushuu, Ichimura Tetsunosuke's thirst for revenge leads him to desire strength. At the age of 15, Tetsunosuke approached the Shinsengumi, wanting to become one of its members. However, Tetsunosuke lacked the skill, mind, and will to emotionlessly cut down whoever threatened peace and the Shinsengumi. Even with the support of his brother Tatsunosuke and his newfound friends of the Shinsengumi, little did Tetsunosuke know the blood and pain he would have to face being part of this historical group.","[""Animation"", ""History"", ""Action"", ""Drama"", ""Fantasy"", ""Romance""]","Shigeru Kimiya","[""Jouji Nakata"", ""Yuji Ueda"", ""Mitsuki Saiga"", ""Takahiro Sakurai"", ""Yuki Kaji""]"
354912,"Coco","Despite his family’s baffling generations-old ban on music, Miguel dreams of becoming an accomplished musician like his idol, Ernesto de la Cruz. Desperate to prove his talent, Miguel finds himself in the stunning and colorful Land of the Dead following a mysterious chain of events. Along the way, he meets charming trickster Hector, and together, they set off on an extraordinary journey to unlock the real story behind Miguel's family history.","[""Family"", ""Animation"", ""Music"", ""Adventure""]","Lee Unkrich","[""Anthony Gonzalez"", ""Gael Garc\u00eda Bernal"", ""Benjamin Bratt"", ""Alanna Ubach"", ""Renee Victor""]"
786892,"Furiosa: A Mad Max Saga","As the world falls, young Furiosa is snatched from the Green Place of Many Mothers into the hands of a great biker horde led by the warlord Dementus. Sweeping through the wasteland, they encounter the citadel presided over by Immortan Joe. The two tyrants wage war for dominance, and Furiosa must survive many trials as she puts together the means to find her way home.","[""Action"", ""Science Fiction"", ""Adventure""]","George Miller","[""Anya Taylor-Joy"", ""Chris Hemsworth"", ""Tom Burke"", ""Alyla Browne"", ""George Shevtsov""]"
507086,"Jurassic World Dominion","Four years after Isla Nublar was destroyed, dinosaurs now live—and hunt—alongside humans all over the world. This fragile balance will reshape the future and determine, once and for all, whether human beings are to remain the apex predators on a planet they now share with history's most fearsome creatures.","[""Adventure"", ""Action"", ""Science Fiction""]","Colin Trevorrow","[""Chris Pratt"", ""Bryce Dallas Howard"", ""Laura Dern"", ""Sam Neill"", ""Jeff Goldblum""]"
26466,"Triangle","When Jess sets sail on a yacht with a group of friends, she cannot shake the feeling that there is something wrong.","[""Horror""]","Christopher Smith","[""Melissa George"", ""Liam Hemsworth"", ""Emma Lung"", ""Rachael Carpani"", ""Michael Dorman""]"
574475,"Final Destination: Bloodlines","Plagued by a violent recurring nightmare, college student Stefanie heads home to track down the one person who might be able to break the cycle and save her family from the grisly demise that inevitably awaits them all.","[""Horror"", ""Mystery""]","Adam B. Stein","[""Kaitlyn Santa Juana"", ""Teo Briones"", ""Richard Harmon"", ""Owen Patrick Joyner"", ""Anna Lore""]"
1267217,"Sugar Baby","Love comes without asking. Often not to those, not so and not then. Can a genuine feeling survive when everything started wrong and the whole world is against it? Give up everything or give up? Burn or survive?","[""Romance"", ""Drama""]","Alexander Prost","[""Daniil Vorobyov"", ""Angelina Zagrebina"", ""Alla Yuganova"", ""Anastasiya Panina"", ""Vladimir Zherebtsov""]"
36362,"King of Kings","Who is Jesus, and why does he impact all he meets? He is respected and reviled, emulated and accused, beloved, betrayed, and finally crucified. Yet that terrible fate would not be the end of the story.","[""Drama"", ""History""]","Nicholas Ray","[""Jeffrey Hunter"", ""Siobh\u00e1n McKenna"", ""Hurd Hatfield"", ""Ron Randell"", ""Viveca Lindfors""]"
454626,"Sonic the Hedgehog","Powered with incredible speed, Sonic The Hedgehog embraces his new home on Earth. That is, until Sonic sparks the attention of super-uncool evil genius Dr. Robotnik. Now it’s super-villain vs. super-sonic in an all-out race across the globe to stop Robotnik from using Sonic’s unique power for world domination.","[""Action"", ""Science Fiction"", ""Comedy"", ""Family""]","Jeff Fowler","[""Ben Schwartz"", ""James Marsden"", ""Tika Sumpter"", ""Jim Carrey"", ""Natasha Rothwell""]"
290098,"The Handmaiden","1930s Korea, in the period of Japanese occupation, a new girl, Sookee, is hired as a handmaiden to a Japanese heiress, Hideko, who lives a secluded life on a large countryside estate with her domineering Uncle Kouzuki. But the maid has a secret. She is a pickpocket recruited by a swindler posing as a Japanese Count to help him seduce the Lady to elope with him, rob her of her fortune, and lock her up in a madhouse. The plan seems to proceed according to plan until Sookee and Hideko discover some unexpected emotions.","[""Thriller"", ""Drama"", ""Romance""]","Park Chan-wook","[""Kim Min-hee"", ""Kim Tae-ri"", ""Ha Jung-woo"", ""Cho Jin-woong"", ""Kim Hae-sook""]"
1084736,"The Count of Monte Cristo","Edmond Dantes becomes the target of a sinister plot and is arrested on his wedding day for a crime he did not commit. After 14 years in the island prison of Château d’If, he manages a daring escape. Now rich beyond his dreams, he assumes the identity of the Count of Monte-Cristo and exacts his revenge on the three men who betrayed him.","[""Adventure"", ""Action"", ""Drama""]","Alexandre de La Patellière","[""Pierre Niney"", ""Bastien Bouillon"", ""Ana\u00efs Demoustier"", ""Laurent Lafitte"", ""Pierfrancesco Favino""]"
1275209,"May I Speak with the Enemy?","Madrid, 1936. Miguel Gila lives peacefully and happily with his grandparents in a humble attic. But the outbreak of the Civil War forces Miguel, along with his friend Pedro, to go to fight. There Gila survives misery, battles, firing squad and jail thanks to his humor. Because of this unique way of interpreting the world around him, Gila will become one of the most popular comedians in Spain and Latin America.","[""Drama"", ""Comedy"", ""War""]","Alexis Morante","[""\u00d3scar Lasarte"", ""Carlos Cuevas"", ""Adelfa Calvo"", ""Natalia de Molina"", ""Salva Reina""]"
653346,"Kingdom of the Planet of the Apes","Several generations following Caesar's reign, apes – now the dominant species – live harmoniously while humans have been reduced to living in the shadows. As a new tyrannical ape leader builds his empire, one young ape undertakes a harrowing journey that will cause him to question all he's known about the past and to make choices that will define a future for apes and humans alike.","[""Science Fiction"", ""Adventure"", ""Action"", ""Drama"", ""Thriller""]","Wes Ball","[""Owen Teague"", ""Freya Allan"", ""Kevin Durand"", ""Peter Macon"", ""William H. Macy""]"
1726,"Iron Man","After being held captive in an Afghan cave, billionaire engineer Tony Stark creates a unique weaponized suit of armor to fight evil.","[""Action"", ""Science Fiction"", ""Adventure""]","Jon Favreau","[""Robert Downey Jr."", ""Terrence Howard"", ""Jeff Bridges"", ""Gwyneth Paltrow"", ""Leslie Bibb""]"
505642,"Black Panther: Wakanda Forever","Queen Ramonda, Shuri, M’Baku, Okoye and the Dora Milaje fight to protect their nation from intervening world powers in the wake of King T’Challa’s death.  As the Wakandans strive to embrace their next chapter, the heroes must band together with the help of War Dog Nakia and Everett Ross and forge a new path for the kingdom of Wakanda.","[""Action"", ""Adventure"", ""Science Fiction""]","Ryan Coogler","[""Letitia Wright"", ""Tenoch Huerta Mej\u00eda"", ""Lupita Nyong'o"", ""Danai Gurira"", ""Winston Duke""]"
9837,"The Prince of Egypt","The strong bond between two brothers is challenged when their chosen responsibilities set them at odds, with extraordinary consequences.","[""Adventure"", ""Animation"", ""Drama"", ""Family""]","Brenda Chapman","[""Val Kilmer"", ""Ralph Fiennes"", ""Michelle Pfeiffer"", ""Sandra Bullock"", ""Jeff Goldblum""]"
408,"Snow White and the Seven Dwarfs","A beautiful girl, Snow White, takes refuge in the forest in the house of seven dwarfs to hide from her stepmother, the wicked Queen. The Queen is jealous because she wants to be known as ""the fairest in the land,"" and Snow White's beauty surpasses her own.","[""Fantasy"", ""Animation"", ""Family""]","David Hand","[""Adriana Caselotti"", ""Lucille La Verne"", ""Harry Stockwell"", ""Roy Atwell"", ""Pinto Colvig""]"
177572,"Big Hero 6","A special bond develops between plus-sized inflatable robot Baymax, and prodigy Hiro Hamada, who team up with a group of friends to form a band of high-tech heroes.","[""Adventure"", ""Family"", ""Animation"", ""Action"", ""Comedy""]","Don Hall","[""Scott Adsit"", ""Ryan Potter"", ""Daniel Henney"", ""T.J. Miller"", ""Jamie Chung""]"
425,"Ice Age","With the impending ice age almost upon them, a mismatched trio of prehistoric critters – Manny the woolly mammoth, Diego the saber-toothed tiger and Sid the giant sloth – find an orphaned infant and decide to return it to its human parents. Along the way, the unlikely allies become friends but, when enemies attack, their quest takes on far nobler aims.","[""Animation"", ""Comedy"", ""Family"", ""Adventure""]","Chris Wedge","[""Ray Romano"", ""John Leguizamo"", ""Denis Leary"", ""Goran Vi\u0161nji\u0107"", ""Jack Black""]"
11324,"Shutter Island","World War II soldier-turned-U.S. Marshal Teddy Daniels investigates the disappearance of a patient from a hospital for the criminally insane, but his efforts are compromised by troubling visions and a mysterious doctor.","[""Drama"", ""Thriller"", ""Mystery""]","Martin Scorsese","[""Leonardo DiCaprio"", ""Mark Ruffalo"", ""Ben Kingsley"", ""Max von Sydow"", ""Michelle Williams""]"
585,"Monsters, Inc.","Lovable Sulley and his wisecracking sidekick Mike Wazowski are the top scare team at Monsters, Inc., the scream-processing factory in Monstropolis. When a little girl named Boo wanders into their world, it's the monsters who are scared silly, and it's up to Sulley and Mike to keep her out of sight and get her back home.","[""Animation"", ""Comedy"", ""Family""]","Pete Docter","[""John Goodman"", ""Billy Crystal"", ""Mary Gibbs"", ""Steve Buscemi"", ""James Coburn""]"
537915,"After","Tessa Young is a dedicated student, dutiful daughter and loyal girlfriend to her high school sweetheart. Entering her first semester of college, Tessa's guarded world opens up when she meets Hardin Scott, a mysterious and brooding rebel who makes her question all she thought she knew about herself -- and what she wants out of life.","[""Romance"", ""Drama""]","Jenny Gage","[""Josephine Langford"", ""Hero Fiennes Tiffin"", ""Shane Paul McGhie"", ""Khadijha Red Thunder"", ""Dylan Arnold""]"
1010335,"Shufu to Sei-seikatsu","A woman marries the fiancé of her late sister but begins to have doubts when he starts to get overly friendly with a former classmate.","[""Drama""]","Yasuhiro Horiuchi","[""Jun Izumi"", ""Kaoru Mizuki"", ""Katsumi \u00d4taki"", ""Masahiko Abe"", ""Akira Hanaue""]"
315162,"Puss in Boots: The Last Wish","Puss in Boots discovers that his passion for adventure has taken its toll: He has burned through eight of his nine lives, leaving him with only one life left. Puss sets out on an epic journey to find the mythical Last Wish and restore his nine lives.","[""Animation"", ""Adventure"", ""Fantasy"", ""Comedy"", ""Family""]","Joel Crawford","[""Antonio Banderas"", ""Salma Hayek Pinault"", ""Harvey Guill\u00e9n"", ""Wagner Moura"", ""Florence Pugh""]"
210577,"Gone Girl","With his wife's disappearance having become the focus of an intense media circus, a man sees the spotlight turned on him when it's suspected that he may not be innocent.","[""Mystery"", ""Thriller"", ""Drama""]","David Fincher","[""Ben Affleck"", ""Rosamund Pike"", ""Neil Patrick Harris"", ""Tyler Perry"", ""Carrie Coon""]"
109445,"Frozen","Young princess Anna of Arendelle dreams about finding true love at her sister Elsa’s coronation. Fate takes her on a dangerous journey in an attempt to end the eternal winter that has fallen over the kingdom. She's accompanied by ice delivery man Kristoff, his reindeer Sven, and snowman Olaf. On an adventure where she will find out what friendship, courage, family, and true love really means.","[""Animation"", ""Family"", ""Adventure"", ""Fantasy""]","Chris Buck","[""Kristen Bell"", ""Idina Menzel"", ""Jonathan Groff"", ""Josh Gad"", ""Livvy Stubenrauch""]"
1188104,"The X-Treme Riders","A fast-paced action drama about siblings desperately needing money for their mother's treatment. Then the brother, who is the stunt performer, inevitably needs to be involved with.","[""Action"", ""Crime""]","Sor Sangchai","[""Jirayu La-ongmanee"", ""Wawaa Nichari Chokprajakchat"", ""Chaleeda Gilbert"", ""Assaree Wattanayakun"", ""Ratchanont Suprakob""]"
940551,"Migration","After a migrating duck family alights on their pond with thrilling tales of far-flung places, the Mallard family embarks on a family road trip, from New England, to New York City, to tropical Jamaica.","[""Animation"", ""Adventure"", ""Comedy"", ""Family""]","Benjamin Renner","[""Kumail Nanjiani"", ""Elizabeth Banks"", ""Caspar Jennings"", ""Tresi Gazal"", ""Awkwafina""]"
744746,"Caveat","A lone drifter suffering from partial memory loss accepts a job to look after a psychologically troubled woman in an abandoned house on an isolated island.","[""Horror"", ""Mystery"", ""Thriller""]","Damian Mc Carthy","[""Jonathan French"", ""Leila Sykes"", ""Ben Caplan"", ""Conor Dwane"", ""Inma Pavon""]"
637649,"Wrath of Man","A cold and mysterious new security guard for a Los Angeles cash truck company surprises his co-workers when he unleashes precision skills during a heist. The crew is left wondering who he is and where he came from. Soon, the marksman's ultimate motive becomes clear as he takes dramatic and irrevocable steps to settle a score.","[""Action"", ""Crime"", ""Thriller""]","Guy Ritchie","[""Jason Statham"", ""Holt McCallany"", ""Josh Hartnett"", ""Scott Eastwood"", ""Darrell D'Silva""]"
313369,"La La Land","Mia, an aspiring actress, serves lattes to movie stars in between auditions and Sebastian, a jazz musician, scrapes by playing cocktail party gigs in dingy bars, but as success mounts they are faced with decisions that begin to fray the fragile fabric of their love affair, and the dreams they worked so hard to maintain in each other threaten to rip them apart.","[""Comedy"", ""Drama"", ""Romance"", ""Music""]","Damien Chazelle","[""Ryan Gosling"", ""Emma Stone"", ""John Legend"", ""Rosemarie DeWitt"", ""J.K. Simmons""]"
218,"The Terminator","In the post-apocalyptic future, reigning tyrannical supercomputers teleport a cyborg assassin known as the ""Terminator"" back to 1984 to kill Sarah Connor, whose unborn son is destined to lead insurgents against 21st century mechanical hegemony. Meanwhile, the human-resistance movement dispatches a lone warrior to safeguard Sarah. Can he stop the virtually indestructible killing machine?","[""Action"", ""Thriller"", ""Science Fiction""]","James Cameron","[""Arnold Schwarzenegger"", ""Michael Biehn"", ""Linda Hamilton"", ""Paul Winfield"", ""Lance Henriksen""]"
38757,"Tangled","Feisty teenager Rapunzel, who has long and magical hair, wants to go and see sky lanterns on her eighteenth birthday, but she's bound to a tower by her overprotective mother. She strikes a deal with Flynn Rider, a charming wanted thief, and the duo set off on an action-packed escapade.","[""Animation"", ""Family"", ""Adventure""]","Nathan Greno","[""Mandy Moore"", ""Zachary Levi"", ""Donna Murphy"", ""Ron Perlman"", ""M.C. Gainey""]"
1241752,"Rita","Rita, who finds herself alone when husband Ariel works abroad. They both find solace and sexual satisfaction in other people. When Ariel comes back, they both act like nothing happened. But will this keep their marriage from falling apart?","[""Drama""]","","[""Christine Bermas"", ""Gold Aceron"", ""VR Relosa"", ""Josh Ivan Morales"", ""Sahil Khan""]"
228150,"Fury","In the last months of World War II, as the Allies make their final push in the European theatre, a battle-hardened U.S. Army sergeant named 'Wardaddy' commands a Sherman tank called 'Fury' and its five-man crew on a deadly mission behind enemy lines. Outnumbered and outgunned, Wardaddy and his men face overwhelming odds in their heroic attempts to strike at the heart of Nazi Germany.","[""War"", ""Drama"", ""Action""]","David Ayer","[""Brad Pitt"", ""Shia LaBeouf"", ""Logan Lerman"", ""Michael Pe\u00f1a"", ""Jon Bernthal""]"
13,"Forrest Gump","A man with a low IQ has accomplished great things in his life and been present during significant historic events—in each case, far exceeding what anyone imagined he could do. But despite all he has achieved, his one true love eludes him.","[""Comedy"", ""Drama"", ""Romance""]","Robert Zemeckis","[""Tom Hanks"", ""Robin Wright"", ""Gary Sinise"", ""Sally Field"", ""Mykelti Williamson""]"
156022,"The Equalizer","McCall believes he has put his mysterious past behind him and dedicated himself to beginning a new, quiet life. But when he meets Teri, a young girl under the control of ultra-violent Russian gangsters, he can’t stand idly by – he has to help her. Armed with hidden skills that allow him to serve vengeance against anyone who would brutalize the helpless, McCall comes out of his self-imposed retirement and finds his desire for justice reawakened. If someone has a problem, if the odds are stacked against them, if they have nowhere else to turn, McCall will help. He is The Equalizer.","[""Thriller"", ""Action"", ""Crime""]","Antoine Fuqua","[""Denzel Washington"", ""Marton Csokas"", ""Chlo\u00eb Grace Moretz"", ""David Harbour"", ""Haley Bennett""]"
41264,"Africa Addio","A chronicle of the violence that occurred in much of the African continent throughout the 1960s. As many African countries were transitioning from colonial rule to other forms of government, violent political upheavals were frequent. Revolutions in Zanzibar and Kenya in which thousands were killed are shown, the violence not only political; there is also extensive footage of hunters and poachers slaughtering different types of wild animals.","[""Documentary"", ""Horror""]","Gualtiero Jacopetti","[""Sergio Rossi"", ""Jomo Kenyatta"", ""Gualtiero Jacopetti"", ""Julius Nyerere"", ""Mo\u00efse Kapenda Tshombe""]"
216015,"Fifty Shades of Grey","When college senior Anastasia Steele steps in for her sick roommate to interview prominent businessman Christian Grey for their campus paper, little does she realize the path her life will take. Christian, as enigmatic as he is rich and powerful, finds himself strangely drawn to Ana, and she to him. Though sexually inexperienced, Ana plunges headlong into an affair -- and learns that Christian's true sexual proclivities push the boundaries of pain and pleasure.","[""Drama"", ""Romance"", ""Thriller""]","Sam Taylor-Johnson","[""Dakota Johnson"", ""Jamie Dornan"", ""Jennifer Ehle"", ""Eloise Mumford"", ""Victor Rasuk""]"
717196,"Niko: Beyond the Northern Lights","Niko the reindeer joins his father in Santa's Flying Forces, but when Santa's sleigh is stolen by an acquaintance, Niko must find it in time for Christmas.","[""Animation"", ""Family"", ""Fantasy""]","Kari Juusonen","[""Matthew Whelan"", ""Emma Jenkins"", ""Paul Tylak"", ""Roger Gregg"", ""Dermot Magennis""]"
