"id","title","overview","genres","director","cast"
7131,"Van Helsing","Famed monster slayer Gabriel Van Helsing is dispatched to Transylvania to assist the last of the Valerious bloodline in defeating Count Dracula. Anna Valerious reveals that Dracula has formed an unholy alliance with Dr. Frankenstein's monster and is hell-bent on exacting a centuries-old curse on her family.","[""Horror"", ""Adventure"", ""Action""]","Stephen Sommers","[""Hugh Jackman"", ""Kate Beckinsale"", ""Richard Roxburgh"", ""David Wenham"", ""Shuler Hensley""]"
1257960,"Sikandar","Sanjay ""Sikandar"" Rajkot, the king of Rajkot, becomes a target for Minister Rakesh Pradhan after he gets in an altercation with his son.","[""Action"", ""Thriller""]","A.R. Murugadoss","[""Salman Khan"", ""Rashmika Mandanna"", ""Sathyaraj"", ""Sharman Joshi"", ""Kajal Agarwal""]"
5915,"Into the Wild","After graduating from Emory University in 1992, top student and athlete Christopher McCandless abandons his possessions, gives his entire $24,000 savings account to charity, and hitchhikes to Alaska to live in the wilderness.","[""Adventure"", ""Drama""]","Sean Penn","[""Emile Hirsch"", ""Marcia Gay Harden"", ""William Hurt"", ""Jena Malone"", ""Brian H. Dierker""]"
116149,"Paddington","A young Peruvian bear travels to London in search of a new home. Finding himself lost and alone at Paddington Station, he meets the kindly Brown family.","[""Comedy"", ""Adventure"", ""Family""]","Paul King","[""Ben Whishaw"", ""Hugh Bonneville"", ""Sally Hawkins"", ""Madeleine Harris"", ""Samuel Joslin""]"
593643,"The Menu","A young couple travels to a remote island to eat at an exclusive restaurant where the chef has prepared a lavish menu, with some shocking surprises.","[""Comedy"", ""Horror"", ""Thriller""]","Mark Mylod","[""Anya Taylor-Joy"", ""Ralph Fiennes"", ""Nicholas Hoult"", ""Janet McTeer"", ""Paul Adelstein""]"
1302004,"Kaskasero","A talented mechanic and driver, Migs quickly finds success when a customer he likes, Gabbi, leads him into the life of street car racing. But as he goes along this life and learns of Gabbi’s past, Migs makes rash decisions that might put the brakes on their relationship.","[""Drama""]","Ludwig Peralta","[""Angela Morena"", ""Itan Magnaye"", ""Marco Gomez"", ""Christine Bermas"", ""Jeffrey Santos""]"
753342,"Napoleon","An epic that details the checkered rise and fall of French Emperor Napoleon Bonaparte and his relentless journey to power through the prism of his addictive, volatile relationship with his wife, Josephine.","[""History"", ""War"", ""Romance""]","Ridley Scott","[""Joaquin Phoenix"", ""Vanessa Kirby"", ""Tahar Rahim"", ""Rupert Everett"", ""Mark Bonnar""]"
969492,"Land of Bad","When a Delta Force special ops mission goes terribly wrong, Air Force drone pilot Reaper has 48 hours to remedy what has devolved into a wild rescue operation. With no weapons and no communication other than the drone above, the ground mission suddenly becomes a full-scale battle when the team is discovered by the enemy.","[""Action"", ""War"", ""Thriller""]","William Eubank","[""Liam Hemsworth"", ""Russell Crowe"", ""Luke Hemsworth"", ""Ricky Whittle"", ""Milo Ventimiglia""]"
345887,"The Equalizer 2","Robert McCall, who serves an unflinching justice for the exploited and oppressed, embarks on a relentless, globe-trotting quest for vengeance when his former partner is murdered.","[""Action"", ""Thriller"", ""Crime""]","Antoine Fuqua","[""Denzel Washington"", ""Pedro Pascal"", ""Ashton Sanders"", ""Orson Bean"", ""Bill Pullman""]"
106,"Predator","A team of elite commandos on a secret mission in a Central American jungle come to find themselves hunted by an extraterrestrial warrior.","[""Science Fiction"", ""Action"", ""Adventure"", ""Thriller""]","John McTiernan","[""Arnold Schwarzenegger"", ""Carl Weathers"", ""Kevin Peter Hall"", ""Elpidia Carrillo"", ""Bill Duke""]"
930094,"Red, White & Royal Blue","After an altercation between Alex, the president's son, and Britain's Prince Henry at a royal event becomes tabloid fodder, their long-running feud now threatens to drive a wedge in U.S./British relations. When the rivals are forced into a staged truce, their icy relationship begins to thaw and the friction between them sparks something deeper than they ever expected.","[""Comedy"", ""Romance""]","Matthew López","[""Taylor Zakhar Perez"", ""Nicholas Galitzine"", ""Uma Thurman"", ""Clifton Collins Jr."", ""Rachel Hilson""]"
9820,"The Parent Trap","Hallie Parker and Annie James are identical twins separated at a young age because of their parents' divorce. Unknowingly to their parents, the girls are sent to the same summer camp where they meet, discover the truth about themselves, and then plot with each other to switch places.","[""Comedy"", ""Family"", ""Romance""]","Nancy Meyers","[""Lindsay Lohan"", ""Dennis Quaid"", ""Natasha Richardson"", ""Elaine Hendrix"", ""Lisa Ann Walter""]"
329,"Jurassic Park","A wealthy entrepreneur secretly creates a theme park featuring living dinosaurs drawn from prehistoric DNA. Before opening day, he invites a team of experts and his two eager grandchildren to experience the park and help calm anxious investors. However, the park is anything but amusing as the security systems go off-line and the dinosaurs escape.","[""Adventure"", ""Science Fiction""]","Steven Spielberg","[""Sam Neill"", ""Laura Dern"", ""Jeff Goldblum"", ""Richard Attenborough"", ""Bob Peck""]"
1422,"The Departed","To take down South Boston's Irish Mafia, the police send in one of their own to infiltrate the underworld, not realizing the syndicate has done likewise. While an undercover cop curries favor with the mob kingpin, a career criminal rises through the police ranks. But both sides soon discover there's a mole among them.","[""Drama"", ""Thriller"", ""Crime""]","Martin Scorsese","[""Leonardo DiCaprio"", ""Matt Damon"", ""Jack Nicholson"", ""Mark Wahlberg"", ""Martin Sheen""]"
504056,"Big Brother","A soldier-turned-high school teacher uses unusual methods to reach to a class of poor students, while dealing with a greedy entrepreneur and his gang of fighters as well as the government.","[""Action"", ""Drama"", ""Comedy""]","Kam Ka-Wai","[""Donnie Yen"", ""Joe Chen"", ""Lok Ming-Kit"", ""Yu Kang"", ""Bruce Tong Kwan-Chi""]"
86834,"Noah","A man who suffers visions of an apocalyptic deluge takes measures to protect his family from the coming flood.","[""Drama"", ""Adventure""]","Darren Aronofsky","[""Russell Crowe"", ""Jennifer Connelly"", ""Ray Winstone"", ""Anthony Hopkins"", ""Emma Watson""]"
1562,"28 Weeks Later","The inhabitants of the British Isles have lost their battle against the onslaught of disease, as the deadly rage virus has killed every citizen there. Six months later, a group of Americans dare to set foot on the Isles, convinced the danger has passed. But it soon becomes all too clear that the scourge continues to live, waiting to pounce on its next victims.","[""Horror"", ""Thriller"", ""Science Fiction""]","Juan Carlos Fresnadillo","[""Robert Carlyle"", ""Rose Byrne"", ""Jeremy Renner"", ""Mackintosh Muggleton"", ""Imogen Poots""]"
1014505,"OVERLORD: The Sacred Kingdom","After twelve years of playing his favorite MMORPG game, Momonga logs in for the last time only to find himself transported into its world playing it indefinitely. Throughout his adventures, his avatar ascends to the title of Sorcerer King Ains Ooal Gown. Once prosperous but now on the brink of ruin, The Sacred Kingdom enjoyed years of peace after construction of an enormous wall protecting them from neighboring invasions. But, one day this comes to an end when the Demon Emperor Jaldabaoth arrives with an army of villainous demi-humans. Fearing invasion of their own lands, the neighboring territory of the Slane Theocracy is forced to beg their enemies at the Sorcerer Kingdom for help. Heeding the call, Momonga, now known as the Sorcerer King Ains Ooal Gown, rallies the Sorcerer Kingdom and its undead army to join the fight alongside the Sacred Kingdom and the Slane Theocracy in hopes to defeat the Demon Emperor.","[""Action"", ""Adventure"", ""Animation"", ""Fantasy""]","Naoyuki Ito","[""Satoshi Hino"", ""Yoshino Aoyama"", ""Hitomi Nabatame"", ""Saori Hayami"", ""Haruka Tomatsu""]"
270946,"Penguins of Madagascar","Skipper, Kowalski, Rico and Private join forces with undercover organization The North Wind to stop the villainous Dr. Octavius Brine from destroying the world as we know it.","[""Family"", ""Animation"", ""Adventure"", ""Comedy""]","Simon J. Smith","[""Tom McGrath"", ""Chris Miller"", ""Christopher Knights"", ""Conrad Vernon"", ""John Malkovich""]"
8355,"Ice Age: Dawn of the Dinosaurs","Times are changing for Manny the moody mammoth, Sid the motor mouthed sloth and Diego the crafty saber-toothed tiger. Life heats up for our heroes when they meet some new and none-too-friendly neighbors – the mighty dinosaurs.","[""Animation"", ""Comedy"", ""Family"", ""Adventure""]","Carlos Saldanha","[""Ray Romano"", ""John Leguizamo"", ""Denis Leary"", ""Queen Latifah"", ""Simon Pegg""]"
345938,"The Shack","A grieving man receives a mysterious, personal invitation to meet with God at a place called 'The Shack'.","[""Drama"", ""Fantasy""]","Stuart Hazeldine","[""Sam Worthington"", ""Octavia Spencer"", ""Tim McGraw"", ""Aviv Alush"", ""Sumire""]"
10528,"Sherlock Holmes","Eccentric consulting detective Sherlock Holmes and Doctor John Watson battle to bring down a new nemesis and unravel a deadly plot that could destroy England.","[""Action"", ""Adventure"", ""Crime"", ""Mystery""]","Guy Ritchie","[""Robert Downey Jr."", ""Jude Law"", ""Rachel McAdams"", ""Mark Strong"", ""Eddie Marsan""]"
666277,"Past Lives","Nora and Hae Sung, two childhood friends, are reunited in New York for one fateful week as they confront notions of destiny, love, and the choices that make a life.","[""Drama"", ""Romance""]","Celine Song","[""Greta Lee"", ""Teo Yoo"", ""John Magaro"", ""Moon Seung-ah"", ""Yim Seung-min""]"
745,"The Sixth Sense","Following an unexpected tragedy, child psychologist Malcolm Crowe meets a nine year old boy named Cole Sear, who is hiding a dark secret.","[""Mystery"", ""Thriller"", ""Drama""]","M. Night Shyamalan","[""Bruce Willis"", ""Haley Joel Osment"", ""Toni Collette"", ""Olivia Williams"", ""Trevor Morgan""]"
37135,"Tarzan","Tarzan was a small orphan who was raised by an ape named Kala since he was a child. He believed that this was his family, but on an expedition Jane Porter is rescued by Tarzan. He then finds out that he's human. Now Tarzan must make the decision as to which family he should belong to...","[""Family"", ""Adventure"", ""Animation"", ""Drama""]","Chris Buck","[""Tony Goldwyn"", ""Minnie Driver"", ""Glenn Close"", ""Alex D. Linz"", ""Rosie O'Donnell""]"
1104844,"BLUE LOCK THE MOVIE -EPISODE NAGI-","When apathetic gamer Nagi agrees to join his rich classmate Mikage in soccer, their partnership leads to the famous Blue Lock program — and to changes.","[""Animation"", ""Action"", ""Drama""]","Shunsuke Ishikawa","[""Nobunaga Shimazaki"", ""Yuma Uchida"", ""Kazuyuki Okitsu"", ""Kazuki Ura"", ""Tasuku Kaito""]"
893723,"PAW Patrol: The Mighty Movie","A magical meteor crash lands in Adventure City and gives the PAW Patrol pups superpowers, transforming them into The Mighty Pups.","[""Family"", ""Comedy"", ""Adventure"", ""Animation""]","Cal Brunker","[""Mckenna Grace"", ""Christian Convery"", ""Taraji P. Henson"", ""Kristen Bell"", ""Lil Rel Howery""]"
4232,"Scream","A year after the murder of her mother, a teenage girl is terrorized by a masked killer who targets her and her friends by using scary movies as part of a deadly game.","[""Crime"", ""Horror"", ""Mystery""]","Wes Craven","[""David Arquette"", ""Neve Campbell"", ""Courteney Cox"", ""Matthew Lillard"", ""Rose McGowan""]"
1433371,"The Pursuit of Lust 3","This intense erotic thriller follows a disheartened woman who goes on a drinking binge after a guy she met online never showed up for their first date. Unfortunately, her drunken state would make her fall victim to a strange taxi driver’s deranged fetishes.","[""Thriller""]","Batdelger Byambasvren","[""G.LKHAGVADORJ"", ""E.BAYRKHUU"", ""Batdelger Bymbasvren""]"
157350,"Divergent","In a world divided into factions based on personality types, Tris learns that she's been classified as Divergent and won't fit in. When she discovers a plot to destroy Divergents, Tris and the mysterious Four must find out what makes Divergents dangerous before it's too late.","[""Action"", ""Adventure"", ""Science Fiction""]","Neil Burger","[""Shailene Woodley"", ""Theo James"", ""Zo\u00eb Kravitz"", ""Miles Teller"", ""Jai Courtney""]"
81188,"Rise of the Guardians","When an evil spirit known as Pitch lays down the gauntlet to take over the world, the immortal Guardians must join forces for the first time to protect the hopes, beliefs and imagination of children all over the world.","[""Animation"", ""Family"", ""Fantasy""]","Peter Ramsey","[""Chris Pine"", ""Alec Baldwin"", ""Jude Law"", ""Isla Fisher"", ""Hugh Jackman""]"
607,"Men in Black","After a police chase with an otherworldly being, a New York City cop is recruited as an agent in a top-secret organization established to monitor and police alien activity on Earth: the Men in Black. Agent K and new recruit Agent J find themselves in the middle of a deadly plot by an intergalactic terrorist who has arrived on Earth to assassinate two ambassadors from opposing galaxies.","[""Action"", ""Adventure"", ""Comedy"", ""Science Fiction""]","Barry Sonnenfeld","[""Tommy Lee Jones"", ""Will Smith"", ""Linda Fiorentino"", ""Vincent D'Onofrio"", ""Rip Torn""]"
437342,"The First Omen","When a young American woman is sent to Rome to begin a life of service to the church, she encounters a darkness that causes her to question her own faith and uncovers a terrifying conspiracy that hopes to bring about the birth of evil incarnate.","[""Horror""]","Arkasha Stevenson","[""Nell Tiger Free"", ""Ralph Ineson"", ""S\u00f4nia Braga"", ""Tawfeek Barhom"", ""Mar\u00eda Caballero""]"
1022796,"Wish","Asha, a sharp-witted idealist, makes a wish so powerful that it is answered by a cosmic force – a little ball of boundless energy called Star. Together, Asha and Star confront a most formidable foe - the ruler of Rosas, King Magnifico - to save her community and prove that when the will of one courageous human connects with the magic of the stars, wondrous things can happen.","[""Animation"", ""Family"", ""Fantasy"", ""Adventure""]","Fawn Veerasunthorn","[""Ariana DeBose"", ""Chris Pine"", ""Alan Tudyk"", ""Angelique Cabral"", ""Victor Garber""]"
399579,"Alita: Battle Angel","When Alita awakens with no memory of who she is in a future world she does not recognize, she is taken in by Ido, a compassionate doctor who realizes that somewhere in this abandoned cyborg shell is the heart and soul of a young woman with an extraordinary past.","[""Action"", ""Science Fiction"", ""Adventure""]","Robert Rodriguez","[""Rosa Salazar"", ""Christoph Waltz"", ""Jennifer Connelly"", ""Mahershala Ali"", ""Ed Skrein""]"
140300,"Kung Fu Panda 3","While Po and his father are visiting a secret panda village, an evil spirit threatens all of China, forcing Po to form a ragtag army to fight back.","[""Action"", ""Adventure"", ""Animation"", ""Comedy"", ""Family""]","Jennifer Yuh Nelson","[""Jack Black"", ""Bryan Cranston"", ""Dustin Hoffman"", ""Angelina Jolie"", ""J.K. Simmons""]"
9880,"The Princess Diaries","A socially awkward but very bright 15-year-old girl being raised by a single mom discovers that she is the princess of a small European country because of the recent death of her long-absent father, who, unknown to her, was the crown prince of Genovia. She must make a choice between continuing the life of a San Francisco teen or stepping up to the throne.","[""Comedy"", ""Family"", ""Romance""]","Garry Marshall","[""Anne Hathaway"", ""Julie Andrews"", ""Heather Matarazzo"", ""Caroline Goodall"", ""H\u00e9ctor Elizondo""]"
937287,"Challengers","Tennis player turned coach Tashi has taken her husband, Art, and transformed him into a world-famous Major champion. To jolt him out of his recent losing streak, she signs him up for a ""Challenger"" event — close to the lowest level of pro tournament — where he finds himself standing across the net from his former best friend and Tashi's former boyfriend.","[""Drama"", ""Romance""]","Luca Guadagnino","[""Zendaya"", ""Mike Faist"", ""Josh O'Connor"", ""Darnell Appling"", ""Bryan Doo""]"
12155,"Alice in Wonderland","Alice, now 19 years old, returns to the whimsical world she first entered as a child and embarks on a journey to discover her true destiny.","[""Family"", ""Fantasy"", ""Adventure""]","Tim Burton","[""Mia Wasikowska"", ""Johnny Depp"", ""Anne Hathaway"", ""Helena Bonham Carter"", ""Crispin Glover""]"
634492,"Madame Web","Forced to confront revelations about her past, paramedic Cassandra Webb forges a relationship with three young women destined for powerful futures...if they can all survive a deadly present.","[""Action"", ""Fantasy""]","S.J. Clarkson","[""Dakota Johnson"", ""Sydney Sweeney"", ""Isabela Merced"", ""Celeste O'Connor"", ""Tahar Rahim""]"
718930,"Bullet Train","Unlucky assassin Ladybug is determined to do his job peacefully after one too many gigs gone off the rails. Fate, however, may have other plans, as Ladybug's latest mission puts him on a collision course with lethal adversaries from around the globe—all with connected, yet conflicting, objectives—on the world's fastest train.","[""Action"", ""Comedy"", ""Thriller""]","David Leitch","[""Brad Pitt"", ""Joey King"", ""Aaron Taylor-Johnson"", ""Brian Tyree Henry"", ""Andrew Koji""]"
61791,"Rise of the Planet of the Apes","A highly intelligent chimpanzee named Caesar has been living a peaceful suburban life ever since he was born. But when he gets taken to a cruel primate facility, Caesar decides to revolt against those who have harmed him.","[""Thriller"", ""Action"", ""Drama"", ""Science Fiction""]","Rupert Wyatt","[""Andy Serkis"", ""James Franco"", ""Freida Pinto"", ""John Lithgow"", ""Brian Cox""]"
1087192,"How to Train Your Dragon","On the rugged isle of Berk, where Vikings and dragons have been bitter enemies for generations, Hiccup stands apart, defying centuries of tradition when he befriends Toothless, a feared Night Fury dragon. Their unlikely bond reveals the true nature of dragons, challenging the very foundations of Viking society.","[""Fantasy"", ""Adventure"", ""Family"", ""Action""]","Dean DeBlois","[""Mason Thames"", ""Nico Parker"", ""Gerard Butler"", ""Nick Frost"", ""Julian Dennison""]"
1294983,"Russian Romance","On one May day in 1864, N. G. Chernyshevsky, a writer and revolutionary democrat, was declared a state criminal and sentenced to hard labor in Siberian mines. A group of young people, raznochintsy, is seeking to include them in the expedition of the Russian Geographical Society with the secret goal of organizing Chernyshevsky’s escape...","[""Romance""]","Vladimir Makedonskiy","[""Nadezhda Butyrtseva"", ""Igor \u010cill\u00edk"", ""Aleksandr Fatyushin"", ""Yevgeniya Kryukova"", ""Aristarkh Livanov""]"
522627,"The Gentlemen","American expat Mickey Pearson has built a highly profitable marijuana empire in London. When word gets out that he’s looking to cash out of the business forever it triggers plots, schemes, bribery and blackmail in an attempt to steal his domain out from under him.","[""Action"", ""Comedy"", ""Crime""]","Guy Ritchie","[""Matthew McConaughey"", ""Charlie Hunnam"", ""Michelle Dockery"", ""Jeremy Strong"", ""Lyne Renee""]"
1100099,"We Live in Time","An up-and-coming chef and a recent divorcée find their lives forever changed when a chance encounter brings them together, in a decade-spanning, deeply moving romance.","[""Romance"", ""Drama""]","John Crowley","[""Andrew Garfield"", ""Florence Pugh"", ""Grace Delaney"", ""Lee Braithwaite"", ""Aoife Hinds""]"
166426,"Pirates of the Caribbean: Dead Men Tell No Tales","Thrust into an all-new adventure, a down-on-his-luck Capt. Jack Sparrow feels the winds of ill-fortune blowing even more strongly when deadly ghost sailors led by his old nemesis, the evil Capt. Salazar, escape from the Devil's Triangle. Jack's only hope of survival lies in seeking out the legendary Trident of Poseidon, but to find it, he must forge an uneasy alliance with a brilliant and beautiful astronomer and a headstrong young man in the British navy.","[""Adventure"", ""Action"", ""Fantasy""]","Joachim Rønning","[""Johnny Depp"", ""Javier Bardem"", ""Geoffrey Rush"", ""Brenton Thwaites"", ""Kaya Scodelario""]"
259316,"Fantastic Beasts and Where to Find Them","In 1926, Newt Scamander arrives at the Magical Congress of the United States of America with a magically expanded briefcase, which houses a number of dangerous creatures and their habitats. When the creatures escape from the briefcase, it sends the American wizarding authorities after Newt, and threatens to strain even further the state of magical and non-magical relations.","[""Fantasy"", ""Adventure""]","David Yates","[""Eddie Redmayne"", ""Katherine Waterston"", ""Dan Fogler"", ""Alison Sudol"", ""Colin Farrell""]"
630,"The Wizard of Oz","Young Dorothy finds herself in a magical world where she makes friends with a lion, a scarecrow and a tin man as they make their way along the yellow brick road to talk with the Wizard and ask for the things they miss most in their lives. The Wicked Witch of the West is the only thing that could stop them.","[""Adventure"", ""Fantasy"", ""Family""]","Victor Fleming","[""Judy Garland"", ""Frank Morgan"", ""Ray Bolger"", ""Bert Lahr"", ""Jack Haley""]"
98566,"Teenage Mutant Ninja Turtles","When a kingpin threatens New York City, a group of mutated turtle warriors must emerge from the shadows to protect their home.","[""Science Fiction"", ""Action"", ""Adventure"", ""Comedy""]","Jonathan Liebesman","[""Pete Ploszek"", ""Alan Ritchson"", ""Jeremy Howard"", ""Noel Fisher"", ""Megan Fox""]"
76338,"Thor: The Dark World","Thor fights to restore order across the cosmos… but an ancient race led by the vengeful Malekith returns to plunge the universe back into darkness. Faced with an enemy that even Odin and Asgard cannot withstand, Thor must embark on his most perilous and personal journey yet, one that will reunite him with Jane Foster and force him to sacrifice everything to save us all.","[""Action"", ""Adventure"", ""Fantasy""]","Alan Taylor","[""Chris Hemsworth"", ""Natalie Portman"", ""Tom Hiddleston"", ""Christopher Eccleston"", ""Anthony Hopkins""]"
976734,"Canary Black","Top level CIA agent Avery Graves is blackmailed by terrorists into betraying her own country to save her kidnapped husband. Cut off from her team, she turns to her underworld contacts to survive and help locate the coveted intelligence that the kidnappers want.","[""Action"", ""Thriller"", ""Crime""]","Pierre Morel","[""Kate Beckinsale"", ""Rupert Friend"", ""Saffron Burrows"", ""Ray Stevenson"", ""Goran Kosti\u0107""]"
1032823,"Trap","A father and teen daughter attend a pop concert, where they realize they're at the center of a dark and sinister event.","[""Horror"", ""Thriller"", ""Mystery""]","M. Night Shyamalan","[""Josh Hartnett"", ""Ariel Donoghue"", ""Saleka Night Shyamalan"", ""Alison Pill"", ""Hayley Mills""]"
51876,"Limitless","The life of an unsuccessful writer is transformed by a top-secret 'smart drug' that allows him to use 100% of his brain and become a perfect version of himself. His enhanced abilities soon attract shadowy forces that threaten his new life.","[""Thriller"", ""Mystery"", ""Science Fiction""]","Neil Burger","[""Bradley Cooper"", ""Robert De Niro"", ""Abbie Cornish"", ""Andrew Howard"", ""Anna Friel""]"
1461519,"Untitled A Minecraft Movie Sequel","The sequel to A Minecraft Movie. Plot TBA.","[""Family"", ""Comedy"", ""Adventure"", ""Fantasy""]","","[]"
324568,"Delinquent in Drag","Does being the only guy in an all girl school sound like paradise? It might be, if the girls knew you were a guy, but to stay in school teenage pervert Banji can't let can't let anyone find out his chromosomes don't match. Banji's status conscious parents want him to go to a good school, but not enough to spend the money on a good co-ed school. Now, in addition to studying math and science, Banji has to learn how to put on a bra and makeup. His life has become a living hell. Not only is he at the bottom of the social pecking order, he must also got to conceal his inner-masculinity from the pretty classmate girl who's stolen his heart while avoiding the female bullies who threaten to expose his less-than-feminine charms in the locker room.","[""Animation"", ""Comedy"", ""Action""]","Yusaku Saotome","[""Kappei Yamaguchi"", ""Hideyuki Tanaka"", ""Reiko Oimori"", ""Yumi Touma"", ""Eiko Yamada""]"
624860,"The Matrix Resurrections","Plagued by strange memories, Neo's life takes an unexpected turn when he finds himself back inside the Matrix.","[""Science Fiction"", ""Action"", ""Adventure""]","Lana Wachowski","[""Keanu Reeves"", ""Carrie-Anne Moss"", ""Yahya Abdul-Mateen II"", ""Jonathan Groff"", ""Jessica Henwick""]"
280002,"The Remaining","When a group of close-knit friends assemble for the marriage of Skylar and Dan, they have no idea they will witness The Rapture and face a series of catastrophic events turning the celebration into a life-or-death struggle.","[""Thriller"", ""Horror""]","Casey La Scala","[""Alexa PenaVega"", ""Johnny Pacar"", ""Shaun Sipos"", ""Italia Ricci"", ""Bryan Dechart""]"
