"id","title","overview","genres","director","cast"
1197306,"A Working Man","Levon Cade left behind a decorated military career in the black ops to live a simple life working construction. But when his boss's daughter, who is like family to him, is taken by human traffickers, his search to bring her home uncovers a world of corruption far greater than he ever could have imagined.","[""Action"", ""Crime"", ""Thriller""]","David Ayer","[""Jason Statham"", ""David Harbour"", ""Michael Pe\u00f1a"", ""Jason Flemyng"", ""Arianna Rivas""]"
324544,"In the Lost Lands","A queen sends the powerful and feared sorceress Gray Alys to the ghostly wilderness of the Lost Lands in search of a magical power, where she and her guide, the drifter Boyce, must outwit and outfight both man and demon.","[""Fantasy"", ""Adventure"", ""Action""]","Paul W. S. Anderson","[""Milla Jovovich"", ""Dave Bautista"", ""Arly Jover"", ""Amara Okereke"", ""Fraser James""]"
950387,"A Minecraft Movie","Four misfits find themselves struggling with ordinary problems when they are suddenly pulled through a mysterious portal into the Overworld: a bizarre, cubic wonderland that thrives on imagination. To get back home, they'll have to master this world while embarking on a magical quest with an unexpected, expert crafter, Steve.","[""Family"", ""Comedy"", ""Adventure"", ""Fantasy""]","Jared Hess","[""Jason Momoa"", ""Jack Black"", ""Sebastian Eugene Hansen"", ""Emma Myers"", ""Danielle Brooks""]"
1045938,"G20","After the G20 Summit is overtaken by terrorists, President Danielle Sutton must bring all her statecraft and military experience to defend her family and her fellow leaders.","[""Action"", ""Mystery"", ""Drama""]","Patricia Riggen","[""Viola Davis"", ""Anthony Anderson"", ""Marsai Martin"", ""Ram\u00f3n Rodr\u00edguez"", ""Douglas Hodge""]"
1195506,"Novocaine","When the girl of his dreams is kidnapped, everyman Nate turns his inability to feel pain into an unexpected strength in his fight to get her back.","[""Action"", ""Comedy"", ""Thriller""]","Dan Berk","[""Jack Quaid"", ""Amber Midthunder"", ""Ray Nicholson"", ""Jacob Batalon"", ""Betty Gabriel""]"
1293286,"Gunslingers","When the most wanted man in America surfaces in a small Kentucky town, his violent history -- and a blood-thirsty mob seeking vengeance and a king’s ransom -- soon follow. As brothers face off against one another and bullets tear the town to shreds, this lightning-fast gunslinger makes his enemies pay the ultimate price for their greed.","[""Western"", ""Action""]","Brian Skiba","[""Stephen Dorff"", ""Heather Graham"", ""Nicolas Cage"", ""Randall Batinkoff"", ""Cooper Barnes""]"
822119,"Captain America: Brave New World","After meeting with newly elected U.S. President Thaddeus Ross, Sam finds himself in the middle of an international incident. He must discover the reason behind a nefarious global plot before the true mastermind has the entire world seeing red.","[""Action"", ""Thriller"", ""Science Fiction""]","Julius Onah","[""Anthony Mackie"", ""Harrison Ford"", ""Danny Ramirez"", ""Shira Haas"", ""Tim Blake Nelson""]"
1244944,"The Woman in the Yard","In the aftermath of her husband's death, widow Ramona's struggle to raise her two kids is hindered by the arrival of a mysterious woman with supernatural abilities.","[""Horror"", ""Mystery""]","Jaume Collet-Serra","[""Danielle Deadwyler"", ""Okwui Okpokwasili"", ""Peyton Jackson"", ""Estella Kahiha"", ""Russell Hornsby""]"
615,"The Passion of the Christ","A graphic portrayal of the last twelve hours of Jesus of Nazareth's life.","[""Drama""]","Mel Gibson","[""Jim Caviezel"", ""Maia Morgenstern"", ""Christo Jivkov"", ""Francesco De Vito"", ""Monica Bellucci""]"
1312833,"A Knight's War","A fearless knight braves a deadly realm to save the Chosen One’s soul. Facing witches, demons, and brutal foes, he discovers her return could ignite chaos and doom humanity.","[""Horror"", ""Action"", ""Fantasy""]","Matthew Ninaber","[""Jeremy Ninaber"", ""Kristen Kaster"", ""Matthew Ninaber"", ""Kristen MacCulloch"", ""Sasha Ormond""]"
1353117,"Home Sweet Home: Rebirth","When a city is overrun with a demonically-possessed crowd, a cop must find the source of evil to save his family.","[""Horror"", ""Fantasy"", ""Thriller"", ""Mystery"", ""Action""]","Alexander Kiesl","[""Michele Morrone"", ""William Moseley"", ""Urassaya Sperbund"", ""Alexander"", ""Ting Sue""]"
1233413,"Sinners","Trying to leave their troubled lives behind, twin brothers return to their hometown to start again, only to discover that an even greater evil is waiting to welcome them back.","[""Drama"", ""Horror"", ""Thriller""]","Ryan Coogler","[""Michael B. Jordan"", ""Miles Caton"", ""Hailee Steinfeld"", ""Wunmi Mosaku"", ""Jack O'Connell""]"
1241982,"Moana 2","After receiving an unexpected call from her wayfinding ancestors, Moana journeys alongside Maui and a new crew to the far seas of Oceania and into dangerous, long-lost waters for an adventure unlike anything she's ever faced.","[""Animation"", ""Adventure"", ""Family"", ""Comedy""]","David G. Derrick Jr.","[""Auli\u02bbi Cravalho"", ""Dwayne Johnson"", ""Hual\u0101lai Chung"", ""Rose Matafeo"", ""David Fane""]"
1125899,"Cleaner","When a group of radical activists take over an energy company's annual gala, seizing 300 hostages, an ex-soldier turned window cleaner suspended 50 storeys up on the outside of the building must save those trapped inside, including her younger brother.","[""Action"", ""Thriller""]","Martin Campbell","[""Daisy Ridley"", ""Clive Owen"", ""Taz Skylar"", ""Flavia Watson"", ""Ray Fearon""]"
762509,"Mufasa: The Lion King","Mufasa, a cub lost and alone, meets a sympathetic lion named Taka, the heir to a royal bloodline. The chance meeting sets in motion an expansive journey of a group of misfits searching for their destiny.","[""Adventure"", ""Family"", ""Animation""]","Barry Jenkins","[""Aaron Pierre"", ""Kelvin Harrison, Jr."", ""Tiffany Boone"", ""Kagiso Lediga"", ""Preston Nyman""]"
939243,"Sonic the Hedgehog 3","Sonic, Knuckles, and Tails reunite against a powerful new adversary, Shadow, a mysterious villain with powers unlike anything they have faced before. With their abilities outmatched in every way, Team Sonic must seek out an unlikely alliance in hopes of stopping Shadow and protecting the planet.","[""Action"", ""Science Fiction"", ""Comedy"", ""Family"", ""Adventure"", ""Fantasy""]","Jeff Fowler","[""Jim Carrey"", ""Ben Schwartz"", ""Keanu Reeves"", ""Idris Elba"", ""Colleen O'Shaughnessey""]"
1229730,"Carjackers","By day, they're invisible—valets, hostesses, and bartenders at a luxury hotel. By night, they're the Carjackers, a crew of skilled drivers who track and rob wealthy clients on the road. As they plan their ultimate heist, the hotel director hires a ruthless hitman, to stop them at all costs. With danger closing in, can Nora, Zoe, Steve, and Prestance pull off their biggest score yet?","[""Action"", ""Adventure""]","Kamel Guemra","[""Zo\u00e9 Marchal"", ""Franck Gastambide"", ""Bosh"", ""Mareva Ranarivelo"", ""Alassane Diong""]"
1373723,"The Codes of War","War stories about family, ethics and honor include the true story of two U.S. Marines who in a span of six seconds, must stand their ground to stop a suicide truck bomb, a Navy Corpsman who attempts to hold on to his humanity, and a WW2 soldier who gets separated from his squad and is forced to re-evaluate his code.","[""Action"", ""War""]","Paul Anderson","[""Noah Gray-Cabey"", ""Michael Grant""]"
1195585,"The Hard Hit","An Interpol agent hunting the head of a global crime syndicate tracks his target to Las Vegas, but when the criminal organization kills his wife and daughter, he goes above the law to get his revenge.","[""Action"", ""Thriller"", ""Crime""]","Darien Smith","[""Brian Ronan Mulroy"", ""Jamie Ohlsen"", ""Malachi Durant"", ""Rob LaColla Jr."", ""Trae Ireland""]"
1403735,"Laila","Sonu Model, a renowned beautician from the old city, is forced to disguise himself as Laila, leading to a series of comedic, romantic, and action-packed events. Chaos ensues in this hilarious laugh riot","[""Comedy"", ""Romance""]","Ram Narayan","[""Vishwak Sen"", ""Akanksha Sharma"", ""Babloo Prithiveeraj"", ""Abhimanyu Singh"", ""Vineet Kumar""]"
696506,"Mickey 17","Unlikely hero Mickey Barnes finds himself in the extraordinary circumstance of working for an employer who demands the ultimate commitment to the job… to die, for a living.","[""Science Fiction"", ""Comedy"", ""Adventure""]","Bong Joon Ho","[""Robert Pattinson"", ""Naomi Ackie"", ""Steven Yeun"", ""Mark Ruffalo"", ""Toni Collette""]"
1252309,"Ask Me What You Want","After his father's death, Eric Zimmerman travels to Spain to oversee his company's branches. In Madrid, he falls for Judith and engage in an intense, erotic relationship full of exploration. However, Eric fears his secret may end their affair.","[""Romance"", ""Drama""]","Lucía Alemany","[""Gabriela Andrada"", ""Mario Ermito"", ""Celia Freijeiro"", ""David Solans"", ""Alba Ribas""]"
1195430,"Deva","Dev Ambre, a ruthless cop, loses his memory in an accident just after he has finished solving a murder case and now has to reinvestigate it while keeping his memory loss a secret from everyone except DCP Farhan Khan.","[""Action"", ""Thriller"", ""Mystery"", ""Crime""]","Rosshan Andrrews","[""Shahid Kapoor"", ""Pooja Hegde"", ""Pavail Gulati"", ""Pravessh Rana"", ""Girish Kulkarni""]"
1101401,"Sugar Baby","An enterprising Sugar Baby is offered $30,000 to move in with her Sugar Daddy for the week, but soon discovers the sinister secrets trapped within his home.","[""Thriller"", ""Comedy""]","Lauren Garroni","[""Mary Beth Barone"", ""Nina Bloomgarden"", ""James Tupper"", ""Theo Germaine"", ""Paige Collins""]"
1208808,"Night Shift","A young nurse with a domestic abuse past starts working the night shift at a small hospital, where, during the night, the ghost of a nurse materializes.","[""Horror""]","Rigoberto Castañeda","[""Paulina Gaita\u0301n"", ""Tony Dalton"", ""Patricia Reyes Sp\u00edndola"", ""Enoc Lea\u00f1o"", ""Fernanda Echevarr\u00eda del Rivero""]"
1126166,"Flight Risk","A U.S. Marshal escorts a government witness to trial after he's accused of getting involved with a mob boss, only to discover that the pilot who is transporting them is also a hitman sent to assassinate the informant. After they subdue him, they're forced to fly together after discovering that there are others attempting to eliminate them.","[""Action"", ""Thriller""]","Mel Gibson","[""Mark Wahlberg"", ""Michelle Dockery"", ""Topher Grace"", ""Leah Remini"", ""Maaz Ali""]"
1165067,"Cosmic Chaos","Battles in virtual reality, survival in a post-apocalyptic wasteland, a Soviet spaceship giving a distress signal - Fantastic stories created with advanced special effects and passion.","[""Thriller"", ""Science Fiction""]","","[""Curtis Bechdholt"", ""Caroline Dhavernas"", ""Ken Godmere"", ""Jeananne Goossen"", ""Samantha Neale""]"
1087891,"The Amateur","After his life is turned upside down when his wife is killed in a London terrorist attack, a brilliant but introverted CIA decoder takes matters into his own hands when his supervisors refuse to take action.","[""Thriller"", ""Action""]","James Hawes","[""Rami Malek"", ""Holt McCallany"", ""Danny Sapani"", ""Rachel Brosnahan"", ""Michael Stuhlbarg""]"
1261050,"The Quiet Ones","In 2008, a group of men from Denmark and across Europe pull off the biggest heist of all time on Danish soil. Kasper, a boxer with few chances left in life, is offered the opportunity to plan the robbery by its foreign initiators.","[""Action"", ""Drama""]","Frederik Louis Hviid","[""Gustav Dyekj\u00e6r Giese"", ""Reda Kateb"", ""Amanda Collin"", ""Christopher Wagelin"", ""Jens Hult\u00e9n""]"
950396,"The Gorge","Two highly trained operatives grow close from a distance after being sent to guard opposite sides of a mysterious gorge. When an evil below emerges, they must work together to survive what lies within.","[""Romance"", ""Science Fiction"", ""Thriller""]","Scott Derrickson","[""Miles Teller"", ""Anya Taylor-Joy"", ""Sigourney Weaver"", ""Sope Dirisu"", ""William Houston""]"
1020414,"Peter Pan's Neverland Nightmare","Wendy Darling strikes out in an attempt to rescue her brother Michael from the clutches of the evil Peter Pan who intends to send him to Neverland. Along the way she meets a twisted Tinkerbell, who is hooked on what she thinks is fairy dust.","[""Horror"", ""Thriller"", ""Fantasy""]","Scott Chambers","[""Martin Portlock"", ""Megan Placito"", ""Kit Green"", ""Peter DeSouza-Feighoney"", ""Charity Kase""]"
1103432,"Bloody Escape: Bats out of Hell","After being turned into a cyborg, Kisaragi faces pursuit from vampires and vengeful yakuza.","[""Animation"", ""Action"", ""Science Fiction""]","Goro Taniguchi","[""Jun Fukuyama"", ""Show Hayami"", ""Rina Hidaka"", ""Masayo Kurata""]"
1282980,"825 Forest Road","After a family tragedy, Chuck Wilson hopes to start a new life in Ashland Falls with his wife Maria and little sister Elizabeth, but he quickly discovers that the town has a dark history of being haunted by a ghostly woman who drives residents to suicide.","[""Horror"", ""Thriller""]","Stephen Cognetti","[""Brian Anthony Wilson"", ""Mike Sutton"", ""Lorenzo Beronilla"", ""Elizabeth Vermilyea"", ""Joe Bandelli""]"
1029880,"Nightwatch: Demons Are Forever","Martin's daughter, Emma, takes up a night watch job to find out what happened to her parents almost thirty years ago. A meeting with Wörmer in his cell pulls the serial killer out of his coma and sets in motion a chain of fateful events.","[""Horror"", ""Thriller"", ""Mystery""]","Ole Bornedal","[""Fanny Leander Bornedal"", ""Nikolaj Coster-Waldau"", ""Kim Bodnia"", ""Ulf Pilgaard"", ""Sonja Richter""]"
1226572,"Superboys of Malegaon","The residents of Malegaon look to Bollywood cinema for a much-needed escape from daily drudgery. Amateur filmmaker Nasir Shaikh gets inspired to make a film for the people of Malegaon, by the people of Malegaon. He bands together his ragtag group of friends to bring his vision to life, thereby bringing a fresh lease of life into the town.","[""Comedy"", ""Drama""]","Reema Kagti","[""Adarsh Gourav"", ""Shashank Arora"", ""Vineet Kumar Singh"", ""Anuj Singh Duhan"", ""Saqib Ayub""]"
1297763,"Batman Ninja vs. Yakuza League","The Batman family has returned to the present to discover that Japan has disappeared, and a giant island - Hinomoto - is now in the sky over Gotham City.  At the top sit the Yakuza, a group of superpowered individuals who reign without honor or humanity and look suspiciously like the Justice League. Now, it’s up to Batman and his allies to save Gotham!","[""Animation"", ""Action""]","Jumpei Mizusaki","[""Koichi Yamadera"", ""Yuki Kaji"", ""Kengo Kawanishi"", ""Daisuke Ono"", ""Akira Ishida""]"
447273,"Snow White","Following the benevolent King's disappearance, the Evil Queen dominated the once fair land with a cruel streak. Princess Snow White flees the castle when the Queen, in her jealousy over Snow White's inner beauty, tries to kill her. Deep into the dark woods, she stumbles upon seven magical dwarves and a young bandit named Jonathan. Together, they strive to survive the Queen's relentless pursuit and aspire to take back the kingdom in the process.","[""Family"", ""Fantasy""]","Marc Webb","[""Rachel Zegler"", ""Gal Gadot"", ""Andrew Burnap"", ""Jeremy Swift"", ""Jason Kravits""]"
1302916,"Heart Eyes","When the ""Heart Eyes Killer"" strikes Seattle, a pair of co-workers pulling overtime on Valentine's Day are mistaken for a couple by the elusive couple-hunting killer. Now, they must spend the most romantic night of the year running for their lives.","[""Horror"", ""Comedy"", ""Romance""]","Josh Ruben","[""Olivia Holt"", ""Mason Gooding"", ""Gigi Zumbado"", ""Michaela Watkins"", ""Devon Sawa""]"
1356039,"Counterattack","When a hostage rescue mission creates a new enemy, Capt. Guerrero and his elite soldiers must face an ambush by a criminal group.","[""Action"", ""Adventure"", ""Thriller""]","Chava Cartas","[""Luis Alberti"", ""No\u00e9 Hern\u00e1ndez"", ""Leonardo Alonso"", ""Luis Curiel"", ""Guillermo Nava""]"
912649,"Venom: The Last Dance","Eddie and Venom are on the run. Hunted by both of their worlds and with the net closing in, the duo are forced into a devastating decision that will bring the curtains down on Venom and Eddie's last dance.","[""Action"", ""Science Fiction"", ""Adventure""]","Kelly Marcel","[""Tom Hardy"", ""Chiwetel Ejiofor"", ""Juno Temple"", ""Rhys Ifans"", ""Stephen Graham""]"
1304594,"Una pequeña confusión","Lola and Cuau, a progressive middle-class pair, and Iñigo and Majo, a young conservative, well-heeled duo, turn to artificial insemination as a last resort to have children. In a madcap twist based on actual events, a mix-up at the clinic results in each mom-to-be carrying the other one's baby.","[""Comedy""]","Ariel Winograd","[""Ana de la Reguera"", ""Juanpa Zurita"", ""Vico Escorcia"", ""Cristo Fern\u00e1ndez"", ""Diana Bovio""]"
1212855,"Fight or Flight","A mercenary takes on the job of tracking down a target on a plane but must protect her when they're surrounded by people trying to kill both of them.","[""Action"", ""Comedy"", ""Thriller""]","James Madigan","[""Josh Hartnett"", ""Katee Sackhoff"", ""Marko Zaror"", ""Julian Kostov"", ""Charithra Chandran""]"
1010581,"My Fault","Noah must leave her city, boyfriend, and friends to move into William Leister's mansion, the flashy and wealthy husband of her mother Rafaela. As a proud and independent 17 year old, Noah resists living in a mansion surrounded by luxury. However, it is there where she meets Nick, her new stepbrother, and the clash of their strong personalities becomes evident from the very beginning.","[""Romance"", ""Drama""]","Domingo González","[""Nicole Wallace"", ""Gabriel Guevara"", ""Marta Hazas"", ""Iv\u00e1n S\u00e1nchez"", ""Eva Ruiz""]"
1064486,"Memoir of a Snail","Forcibly separated from her twin brother when they are orphaned, a melancholic misfit learns how to find confidence within herself amid the clutter of misfortunes and everyday life.","[""Animation"", ""Drama"", ""Comedy""]","Adam Elliot","[""Sarah Snook"", ""Kodi Smit-McPhee"", ""Jacki Weaver"", ""Magda Szubanski"", ""Dominique Pinon""]"
519182,"Despicable Me 4","Gru and Lucy and their girls—Margo, Edith and Agnes—welcome a new member to the Gru family, Gru Jr., who is intent on tormenting his dad. Gru also faces a new nemesis in Maxime Le Mal and his femme fatale girlfriend Valentina, forcing the family to go on the run.","[""Animation"", ""Family"", ""Comedy"", ""Science Fiction""]","Chris Renaud","[""Steve Carell"", ""Kristen Wiig"", ""Will Ferrell"", ""Sof\u00eda Vergara"", ""Miranda Cosgrove""]"
1104845,"Plankton: The Movie","Plankton's tangled love story with his sentient computer wife goes sideways when she takes a stand — and decides to destroy the world without him.","[""Animation"", ""Adventure"", ""Comedy"", ""Family"", ""Fantasy""]","Dave Needham","[""Mr. Lawrence"", ""Jill Talley"", ""Tom Kenny"", ""Bill Fagerbakke"", ""Rodger Bumpass""]"
1388366,"Popeye the Slayer Man","A curious group of friends sneak into an abandoned spinach canning factory to film a documentary on the legend of the ""Sailor Man,"" who is said to haunt the factory and local docks.","[""Horror""]","Robert Michael Ryan","[""Sarah Nicklin"", ""Scott Swope"", ""Angela Relucio"", ""Steven McCormack"", ""Mabel Thomas""]"
927342,"Amaran","A heroic true story of Major Mukund Varadarajan, an Indian Army officer who displayed extraordinary bravery during a counterterrorism mission in Kashmir’s Shopian district. The film captures his courage in protecting his nation and the devotion of his wife Indhu Rebecaa Varghese.","[""Action"", ""Drama"", ""Adventure"", ""War""]","Rajkumar Periasamy","[""Sivakarthikeyan"", ""Sai Pallavi"", ""Rahul Bose"", ""Bhuvan Arora"", ""Lallu Prasath""]"
1249385,"Ghost Game","As part of an internet challenge to live undetected in a stranger’s home, a daring couple target an infamous haunted house and endure a series of chilling incidents as they witness a family descending into madness.","[""Horror"", ""Thriller""]","Jill Gevargizian","[""Kia Dorsey"", ""Zaen Haidar"", ""Aiden Hughes"", ""Vienna Maas"", ""Emily Bennett""]"
1405338,"Demon City","Framed for his family's murder and left for dead, an ex-hitman will stop at nothing to exact revenge on the masked ""demons"" who have taken over his city.","[""Action"", ""Crime"", ""Fantasy"", ""Thriller""]","Seiji Tanaka","[""Toma Ikuta"", ""Masahiro Higashide"", ""Miou Tanaka"", ""Ami Touma"", ""Taro Suruga""]"
558449,"Gladiator II","Years after witnessing the death of the revered hero Maximus at the hands of his uncle, Lucius is forced to enter the Colosseum after his home is conquered by the tyrannical Emperors who now lead Rome with an iron fist. With rage in his heart and the future of the Empire at stake, Lucius must look to his past to find strength and honor to return the glory of Rome to its people.","[""Action"", ""Adventure"", ""Drama""]","Ridley Scott","[""Paul Mescal"", ""Denzel Washington"", ""Pedro Pascal"", ""Connie Nielsen"", ""Joseph Quinn""]"
823219,"Flow","A solitary cat, displaced by a great flood, finds refuge on a boat with various species and must navigate the challenges of adapting to a transformed world together.","[""Animation"", ""Fantasy"", ""Adventure""]","Gints Zilbalodis","[]"
539972,"Kraven the Hunter","Kraven Kravinoff's complex relationship with his ruthless gangster father, Nikolai, starts him down a path of vengeance with brutal consequences, motivating him to become not only the greatest hunter in the world, but also one of its most feared.","[""Action"", ""Adventure"", ""Thriller""]","J.C. Chandor","[""Aaron Taylor-Johnson"", ""Ariana DeBose"", ""Fred Hechinger"", ""Alessandro Nivola"", ""Christopher Abbott""]"
533535,"Deadpool & Wolverine","A listless Wade Wilson toils away in civilian life with his days as the morally flexible mercenary, Deadpool, behind him. But when his homeworld faces an existential threat, Wade must reluctantly suit-up again with an even more reluctant Wolverine.","[""Action"", ""Comedy"", ""Science Fiction""]","Shawn Levy","[""Ryan Reynolds"", ""Hugh Jackman"", ""Emma Corrin"", ""Matthew Macfadyen"", ""Dafne Keen""]"
1156593,"Your Fault","The love between Noah and Nick seems unwavering despite their parents' attempts to separate them. But his job and her entry into college open up their lives to new relationships that will shake the foundations of both their relationship and the Leister family itself.","[""Romance"", ""Drama""]","Domingo González","[""Nicole Wallace"", ""Gabriel Guevara"", ""Marta Hazas"", ""Iv\u00e1n S\u00e1nchez"", ""Eva Ruiz""]"
1160956,"Panda Plan","International action star Jackie Chan is invited to the adoption ceremony of a rare baby panda, but after an international crime syndicate attempts to kidnap the bear, Jackie has to save the bear using his stunt work skills.","[""Action"", ""Comedy""]","Zhang Luan","[""Jackie Chan"", ""Shi Ce"", ""Wei Xiang"", ""Han Yanbo"", ""Danny Ray""]"
1184918,"The Wild Robot","After a shipwreck, an intelligent robot called Roz is stranded on an uninhabited island. To survive the harsh environment, Roz bonds with the island's animals and cares for an orphaned baby goose.","[""Animation"", ""Science Fiction"", ""Family""]","Chris Sanders","[""Lupita Nyong'o"", ""Pedro Pascal"", ""Kit Connor"", ""Bill Nighy"", ""Stephanie Hsu""]"
995926,"I, the Executioner","The veteran detective Seo Do-cheol and his team at Major Crimes, relentless in their pursuit of criminals, join forces with rookie cop Park Sun-woo to track down a serial killer who has plunged the nation into turmoil.","[""Action"", ""Crime""]","Ryoo Seung-wan","[""Hwang Jung-min"", ""Jung Hae-in"", ""Oh Dal-su"", ""Oh Dae-hwan"", ""Jang Yoon-ju""]"
1077782,"Old Guy","Stuck at a dead end but vying for the love of spunky club manager Anata, aging contract killer Danny Dolinski is thrilled when The Company pulls him back in the field, but only to train Gen Z newcomer Wihlborg, a prodigy assassin with an attitude.","[""Action"", ""Comedy""]","Simon West","[""Christoph Waltz"", ""Lucy Liu"", ""Cooper Hoffman"", ""Karishma Navekar"", ""Desmond Edwards""]"
1059643,"Clawfoot","An upper-class suburban housewife is psychologically terrorized by a manipulative contractor remodeling her bathroom... until the tables are turned and a twisted battle of wits ensues with deliciously unexpected results.","[""Thriller""]","Michael Day","[""Francesca Eastwood"", ""Milo Gibson"", ""Olivia Culpo"", ""Oliver Cooper"", ""Nestor Carbonell""]"
1022789,"Inside Out 2","Teenager Riley's mind headquarters is undergoing a sudden demolition to make room for something entirely unexpected: new Emotions! Joy, Sadness, Anger, Fear and Disgust, who’ve long been running a successful operation by all accounts, aren’t sure how to feel when Anxiety shows up. And it looks like she’s not alone.","[""Animation"", ""Adventure"", ""Comedy"", ""Family""]","Kelsey Mann","[""Amy Poehler"", ""Maya Hawke"", ""Kensington Tallman"", ""Liza Lapira"", ""Tony Hale""]"
1217379,"Hellhound","Ready to leave his profession behind, Loreno, an assassin, lends help to an old friend, Cetan, and taking one last job in Thailand seeking out a local kingpin. A lapse in judgment means Loreno crosses paths with old colleague Paul.","[""Action"", ""Crime"", ""Thriller""]","Joshua Dixon","[""Louis Mandylor"", ""Vithaya Pansringarm"", ""Van Quattro"", ""Panya Yimmumphai"", ""Winai Wiangyangkung""]"
