"id","title","overview","genres","director","cast"
6977,"No Country for Old Men","Llewelyn Moss stumbles upon dead bodies, $2 million and a hoard of heroin in a Texas desert, but methodical killer Anton Chigurh comes looking for it, with local sheriff Ed Tom Bell hot on his trail. The roles of prey and predator blur as the violent pursuit of money and justice collide.","[""Crime"", ""Drama"", ""Thriller""]","Joel Coen","[""Javier Bardem"", ""Tommy Lee Jones"", ""Josh Brolin"", ""Woody Harrelson"", ""Kelly Macdonald""]"
1201012,"Dhoom Dhaam","On their wedding night, an oddball couple is thrust into a chaotic chase, dodging goons and cops in a frenzied hunt for the mysterious ""Charlie.""","[""Comedy"", ""Romance"", ""Action""]","Rishab Seth","[""Yami Gautam"", ""Pratik Gandhi"", ""Eijaz Khan"", ""Mukul Chadda"", ""Pavitra Sarkar""]"
240832,"Lucy","A woman, accidentally caught in a dark deal, turns the tables on her captors and transforms into a merciless warrior evolved beyond human logic.","[""Action"", ""Science Fiction""]","Luc Besson","[""Scarlett Johansson"", ""Morgan Freeman"", ""Choi Min-sik"", ""Amr Waked"", ""Julian Rhind-Tutt""]"
1100856,"Whisper of the Witch","Mara, an ancient pagan spirit, hunts a group of teenagers taking their body parts to be reborn. A disillusioned and desperate investigator has to face his deepest fears to save the teenagers.","[""Horror"", ""Thriller""]","Serik Beyseu","[""Arthur Beschastny"", ""Maryana Spivak"", ""Sofya Shidlovskaya"", ""Igor Grabuzov"", ""Sergey Safronov""]"
1013850,"A Real Pain","Mismatched cousins David and Benji reunite for a tour through Poland to honor their beloved grandmother. The adventure takes a turn when the pair's old tensions resurface against the backdrop of their family history.","[""Comedy"", ""Drama""]","Jesse Eisenberg","[""Jesse Eisenberg"", ""Kieran Culkin"", ""Will Sharpe"", ""Jennifer Grey"", ""Kurt Egyiawan""]"
1072790,"Anyone But You","After an amazing first date, Bea and Ben’s fiery attraction turns ice cold — until they find themselves unexpectedly reunited at a destination wedding in Australia. So they do what any two mature adults would do: pretend to be a couple.","[""Romance"", ""Comedy""]","Will Gluck","[""Sydney Sweeney"", ""Glen Powell"", ""Mia Artemis"", ""Nat Buchanan"", ""GaTa""]"
1286663,"Control Freak","A motivational speaker, plagued by an uncontrollable itch on her head, becomes infected with a parasitic demon from her homeland.","[""Horror""]","Shal Ngo","[""Kelly Marie Tran"", ""Miles Robbins"", ""Kieu Chinh"", ""Toan Le"", ""Callie Johnson""]"
359410,"Road House","Ex-UFC fighter Dalton takes a job as a bouncer at a Florida Keys roadhouse, only to discover that this paradise is not all it seems.","[""Action"", ""Thriller""]","Doug Liman","[""Jake Gyllenhaal"", ""Billy Magnussen"", ""Daniela Melchior"", ""Jessica Williams"", ""Conor McGregor""]"
293660,"Deadpool","The origin story of former Special Forces operative turned mercenary Wade Wilson, who, after being subjected to a rogue experiment that leaves him with accelerated healing powers, adopts the alter ego Deadpool. Armed with his new abilities and a dark, twisted sense of humor, Deadpool hunts down the man who nearly destroyed his life.","[""Action"", ""Adventure"", ""Comedy""]","Tim Miller","[""Ryan Reynolds"", ""Morena Baccarin"", ""Ed Skrein"", ""T.J. Miller"", ""Gina Carano""]"
1051896,"Arcadian","In the near future, on a decimated Earth, Paul and his twin sons face terror at night when ferocious creatures awaken. When Paul is nearly killed, the boys come up with a plan for survival, using everything their father taught them to keep him alive.","[""Action"", ""Horror"", ""Thriller"", ""Science Fiction""]","Benjamin Brewer","[""Nicolas Cage"", ""Jaeden Martell"", ""Maxwell Jenkins"", ""Sadie Soverall"", ""Samantha Coughlan""]"
1153714,"Death of a Unicorn","A father and daughter accidentally hit and kill a unicorn while en route to a weekend retreat, where his billionaire boss seeks to exploit the creature’s miraculous curative properties.","[""Horror"", ""Comedy"", ""Fantasy""]","Alex Scharfman","[""Paul Rudd"", ""Jenna Ortega"", ""Will Poulter"", ""Richard E. Grant"", ""T\u00e9a Leoni""]"
105814,"The Imp","Shan is in search of her twin sister who disappeared leaving nothing more than a native doll. Along the way she meets a mobile film crew. They discover that something isn't quite right with the boarding house in which they're staying.","[""Horror""]","Ivan Lai Kai-Ming","[""Diana Pang Dan"", ""Mark Cheng Ho-Nam"", ""Emiko Ishizuka"", ""Dick Lau Tik-Chi"", ""Keith Ng Shui-Ting""]"
1724,"The Incredible Hulk","Scientist Bruce Banner scours the planet for an antidote to the unbridled force of rage within him: the Hulk. But when the military masterminds who dream of exploiting his powers force him back to civilization, he finds himself coming face to face with a new, deadly foe.","[""Science Fiction"", ""Action"", ""Adventure""]","Louis Leterrier","[""Edward Norton"", ""Liv Tyler"", ""Tim Roth"", ""William Hurt"", ""Tim Blake Nelson""]"
863,"Toy Story 2","Andy heads off to Cowboy Camp, leaving his toys to their own devices. Things shift into high gear when an obsessive toy collector named Al McWhiggen, owner of Al's Toy Barn kidnaps Woody. Andy's toys mount a daring rescue mission, Buzz Lightyear meets his match and Woody has to decide where he and his heart truly belong.","[""Animation"", ""Comedy"", ""Family""]","John Lasseter","[""Tom Hanks"", ""Tim Allen"", ""Joan Cusack"", ""Kelsey Grammer"", ""Don Rickles""]"
787,"Mr. & Mrs. Smith","After five (or six) years of vanilla-wedded bliss, ordinary suburbanites John and Jane Smith are stuck in a huge rut. Unbeknownst to each other, they are both coolly lethal, highly-paid assassins working for rival organisations. When they discover they're each other's next target, their secret lives collide in a spicy, explosive mix of wicked comedy, pent-up passion, nonstop action and high-tech weaponry.","[""Action"", ""Comedy"", ""Drama"", ""Thriller""]","Doug Liman","[""Brad Pitt"", ""Angelina Jolie"", ""Vince Vaughn"", ""Adam Brody"", ""Kerry Washington""]"
116745,"The Secret Life of Walter Mitty","A timid magazine photo manager who lives life vicariously through daydreams embarks on a true-life adventure when a negative goes missing.","[""Adventure"", ""Comedy"", ""Drama"", ""Fantasy""]","Ben Stiller","[""Ben Stiller"", ""Kristen Wiig"", ""Sean Penn"", ""Shirley MacLaine"", ""Adam Scott""]"
810,"Shrek the Third","The King of Far Far Away has died and Shrek and Fiona are to become King & Queen. However, Shrek wants to return to his cozy swamp and live in peace and quiet, so when he finds out there is another heir to the throne, they set off to bring him back to rule the kingdom.","[""Fantasy"", ""Adventure"", ""Animation"", ""Comedy"", ""Family""]","Chris Miller","[""Mike Myers"", ""Eddie Murphy"", ""Cameron Diaz"", ""Antonio Banderas"", ""Julie Andrews""]"
1265,"Bridge to Terabithia","Jesse Aarons trained all summer to become the fastest runner in school. So he's very upset when newcomer Leslie Burke outruns him and everyone else. Despite this and other differences including that she's rich, he's poor, she's a city girl, and he's a country boy the two become fast friends. Together they create Terabithia, a land of monsters, trolls, ogres, and giants where they rule as king and queen.","[""Adventure"", ""Drama"", ""Family""]","Gábor Csupó","[""Josh Hutcherson"", ""AnnaSophia Robb"", ""Zooey Deschanel"", ""Robert Patrick"", ""Bailee Madison""]"
1235623,"Eye for an Eye 2","The blind swordsman, skilled in martial arts, named Cheng Xiazi (Xie Miao), accidentally saves Zhang Xiaoyu (Yang Enyou), who has suffered from the destruction of his family. Under the persuasion of the orphan Xiaoyu, Cheng reluctantly keeps him by his side and teaches him skills. Xiaoyu also waits for the opportunity to seek revenge.","[""Action"", ""Drama""]","Yang Bingjia","[""Xie Miao"", ""Yang Enyou"", ""Huang Tao"", ""Pei Kuishan"", ""Pema Jyad""]"
917496,"Beetlejuice Beetlejuice","After a family tragedy, three generations of the Deetz family return home to Winter River. Still haunted by Betelgeuse, Lydia's life is turned upside down when her teenage daughter, Astrid, accidentally opens the portal to the Afterlife.","[""Horror"", ""Comedy"", ""Fantasy""]","Tim Burton","[""Michael Keaton"", ""Winona Ryder"", ""Catherine O'Hara"", ""Jenna Ortega"", ""Justin Theroux""]"
508442,"Soul","Joe Gardner is a middle school teacher with a love for jazz music. After a successful audition at the Half Note Club, he suddenly gets into an accident that separates his soul from his body and is transported to the You Seminar, a center in which souls develop and gain passions before being transported to a newborn child. Joe must enlist help from the other souls-in-training, like 22, a soul who has spent eons in the You Seminar, in order to get back to Earth.","[""Animation"", ""Family"", ""Comedy"", ""Fantasy""]","Pete Docter","[""Jamie Foxx"", ""Tina Fey"", ""Graham Norton"", ""Rachel House"", ""Alice Braga""]"
353491,"The Dark Tower","A boy haunted by visions of a parallel world aids its disillusioned guardian in preventing the destruction of the nexus of universes known as the Dark Tower.","[""Fantasy"", ""Action"", ""Science Fiction""]","Nikolaj Arcel","[""Idris Elba"", ""Matthew McConaughey"", ""Tom Taylor"", ""Claudia Kim"", ""Fran Kranz""]"
384018,"Fast & Furious Presents: Hobbs & Shaw","Ever since US Diplomatic Security Service Agent Hobbs and lawless outcast Shaw first faced off, they just have traded smack talk and body blows. But when cyber-genetically enhanced anarchist Brixton's ruthless actions threaten the future of humanity, they join forces to defeat him.","[""Action"", ""Adventure"", ""Comedy""]","David Leitch","[""Dwayne Johnson"", ""Jason Statham"", ""Idris Elba"", ""Vanessa Kirby"", ""Helen Mirren""]"
843527,"The Idea of You","40-year-old single mom Solène begins an unexpected romance with 24-year-old Hayes Campbell, the lead singer of August Moon, the hottest boy band on the planet. As they begin a whirlwind romance, it isn't long before Hayes' superstar status poses unavoidable challenges to their relationship, and Solène soon discovers that life in the glare of his spotlight might be more than she bargained for.","[""Romance"", ""Drama"", ""Comedy""]","Michael Showalter","[""Anne Hathaway"", ""Nicholas Galitzine"", ""Ella Rubin"", ""Annie Mumolo"", ""Reid Scott""]"
851644,"20th Century Girl","In 1999, a teen girl keeps close tabs on a boy in school on behalf of her deeply smitten best friend – then she gets swept up in a love story of her own.","[""Romance"", ""Drama""]","Bang Woo-ri","[""Kim You-jung"", ""Byeon Woo-seok"", ""Park Jung-woo"", ""Roh Yoon-seo"", ""Kim Sung-kyung""]"
283995,"Guardians of the Galaxy Vol. 2","The Guardians must fight to keep their newfound family together as they unravel the mysteries of Peter Quill's true parentage.","[""Science Fiction"", ""Adventure"", ""Action""]","James Gunn","[""Chris Pratt"", ""Zoe Salda\u00f1a"", ""Dave Bautista"", ""Vin Diesel"", ""Bradley Cooper""]"
466272,"Once Upon a Time... in Hollywood","Los Angeles, 1969. TV star Rick Dalton, a struggling actor specializing in westerns, and stuntman Cliff Booth, his best friend, try to survive in a constantly changing movie industry. Dalton is the neighbor of the young and promising actress and model Sharon Tate, who has just married the prestigious Polish director Roman Polanski…","[""Comedy"", ""Drama"", ""Thriller""]","Quentin Tarantino","[""Leonardo DiCaprio"", ""Brad Pitt"", ""Margot Robbie"", ""Emile Hirsch"", ""Margaret Qualley""]"
926393,"The Equalizer 3","Robert McCall finds himself at home in Southern Italy but he discovers his friends are under the control of local crime bosses. As events turn deadly, McCall knows what he has to do: become his friends' protector by taking on the mafia.","[""Action"", ""Thriller"", ""Crime""]","Antoine Fuqua","[""Denzel Washington"", ""Dakota Fanning"", ""Eugenio Mastrandrea"", ""David Denman"", ""Gaia Scodellaro""]"
49026,"The Dark Knight Rises","Following the death of District Attorney Harvey Dent, Batman assumes responsibility for Dent's crimes to protect the late attorney's reputation and is subsequently hunted by the Gotham City Police Department. Eight years later, Batman encounters the mysterious Selina Kyle and the villainous Bane, a new terrorist leader who overwhelms Gotham's finest. The Dark Knight resurfaces to protect a city that has branded him an enemy.","[""Action"", ""Crime"", ""Drama"", ""Thriller""]","Christopher Nolan","[""Christian Bale"", ""Gary Oldman"", ""Tom Hardy"", ""Joseph Gordon-Levitt"", ""Anne Hathaway""]"
9806,"The Incredibles","Bob Parr has given up his superhero days to log in time as an insurance adjuster and raise his three children with his formerly heroic wife in suburbia. But when he receives a mysterious assignment, it's time to get back into costume.","[""Action"", ""Adventure"", ""Animation"", ""Family""]","Brad Bird","[""Craig T. Nelson"", ""Holly Hunter"", ""Sarah Vowell"", ""Spencer Fox"", ""Jason Lee""]"
147441,"Exodus: Gods and Kings","The defiant leader Moses rises up against the Egyptian Pharaoh Ramses, setting 400,000 slaves on a monumental journey of escape from Egypt and its terrifying cycle of deadly plagues.","[""Adventure"", ""Drama"", ""Action""]","Ridley Scott","[""Christian Bale"", ""Joel Edgerton"", ""Ben Kingsley"", ""John Turturro"", ""Aaron Paul""]"
746036,"The Fall Guy","Fresh off an almost career-ending accident, stuntman Colt Seavers has to track down a missing movie star, solve a conspiracy and try to win back the love of his life while still doing his day job.","[""Action"", ""Comedy"", ""Drama"", ""Romance""]","David Leitch","[""Ryan Gosling"", ""Emily Blunt"", ""Aaron Taylor-Johnson"", ""Hannah Waddingham"", ""Teresa Palmer""]"
1147710,"Hijack 1971","Pilots Tae-in and Gyu-sik are set to fly to Gimpo. Under the guidance of flight attendant Ok-soon, passengers are busy boarding. However, shortly after takeoff, a homemade bomb explodes, turning the cabin into chaos.","[""Action"", ""Thriller"", ""Crime""]","Kim Sung-han","[""Ha Jung-woo"", ""Yeo Jin-goo"", ""Sung Dong-il"", ""Chae Soo-bin"", ""Moon You-kang""]"
8392,"My Neighbor Totoro","Two sisters move to the country with their father in order to be closer to their hospitalized mother, and discover the surrounding trees are inhabited by Totoros, magical spirits of the forest. When the youngest runs away from home, the older sister seeks help from the spirits to find her.","[""Fantasy"", ""Animation"", ""Family""]","Hayao Miyazaki","[""Noriko Hidaka"", ""Chika Sakamoto"", ""Hitoshi Takagi"", ""Shigesato Itoi"", ""Sumi Shimamoto""]"
8392,"My Neighbor Totoro","Two sisters move to the country with their father in order to be closer to their hospitalized mother, and discover the surrounding trees are inhabited by Totoros, magical spirits of the forest. When the youngest runs away from home, the older sister seeks help from the spirits to find her.","[""Fantasy"", ""Animation"", ""Family""]","Hayao Miyazaki","[""Noriko Hidaka"", ""Chika Sakamoto"", ""Hitoshi Takagi"", ""Shigesato Itoi"", ""Sumi Shimamoto""]"
1241320,"Kingdom IV: Return of the Great General","Depicts a continuation of the ""Battle of Mayang"", an all-out war against the neighboring country Zhao that Shin and Wang Ki fought in in the previous work ""Flame of Fate"".","[""Action"", ""Adventure""]","Shinsuke Sato","[""Kento Yamazaki"", ""Takao Osawa"", ""Ryo Yoshizawa"", ""Kanna Hashimoto"", ""Nana Seino""]"
57158,"The Hobbit: The Desolation of Smaug","The Dwarves, Bilbo and Gandalf have successfully escaped the Misty Mountains, and Bilbo has gained the One Ring. They all continue their journey to get their gold back from the Dragon, Smaug.","[""Fantasy"", ""Adventure"", ""Action""]","Peter Jackson","[""Ian McKellen"", ""Martin Freeman"", ""Richard Armitage"", ""Benedict Cumberbatch"", ""Orlando Bloom""]"
1865,"Pirates of the Caribbean: On Stranger Tides","Captain Jack Sparrow crosses paths with a woman from his past, and he's not sure if it's love — or if she's a ruthless con artist who's using him to find the fabled Fountain of Youth. When she forces him aboard the Queen Anne's Revenge, the ship of the formidable pirate Blackbeard, Jack finds himself on an unexpected adventure in which he doesn't know who to fear more: Blackbeard or the woman from his past.","[""Adventure"", ""Action"", ""Fantasy""]","Rob Marshall","[""Johnny Depp"", ""Pen\u00e9lope Cruz"", ""Geoffrey Rush"", ""Ian McShane"", ""Kevin McNally""]"
619264,"The Platform","A slab of food descends down a vertical facility. The residents above eat heartily, leaving those below starving and desperate. A rebellion is imminent.","[""Drama"", ""Science Fiction"", ""Thriller""]","Galder Gaztelu-Urrutia","[""Ivan Massagu\u00e9"", ""Antonia San Juan"", ""Zorion Eguileor"", ""Emilio Buale"", ""Alexandra Masangkay""]"
726139,"Project Silence","Due to sudden deteriorating weather conditions, visibility on the Airport Bridge is severely impaired, leaving people stranded and at risk of the bridge collapsing due to a series of chain collisions and explosions. Amidst the chaos, the canine subjects ""Echo"" from the military experiment ""Project Silence,"" who were being transported in secret, break free, and all human survivors become targets of relentless attacks.","[""Thriller"", ""Action"", ""Horror"", ""Science Fiction"", ""Adventure""]","Kim Tae-gon","[""Lee Sun-kyun"", ""Ju Ji-hoon"", ""Kim Hee-won"", ""Moon Sung-keun"", ""Ye Su-jeong""]"
198184,"Chappie","Every child comes into the world full of promise, and none more so than Chappie: he is gifted, special, a prodigy. Like any child, Chappie will come under the influence of his surroundings—some good, some bad—and he will rely on his heart and soul to find his way in the world and become his own man. But there's one thing that makes Chappie different from any one else: he is a robot.","[""Crime"", ""Action"", ""Science Fiction""]","Neill Blomkamp","[""Sharlto Copley"", ""Dev Patel"", ""Hugh Jackman"", ""Ninja"", ""Yo-Landi Visser""]"
1203653,"Exhibiting Forgiveness","Utilizing his paintings to find freedom from his past, a Black artist on the path to success is derailed by an unexpected visit from his estranged father, a recovering addict desperate to reconcile. Together, they learn that forgetting might be a greater challenge than forgiving.","[""Drama""]","Titus Kaphar","[""Andr\u00e9 Holland"", ""Andra Day"", ""John Earl Jelks"", ""Aunjanue Ellis-Taylor"", ""Daniel Michael Barriere""]"
39254,"Real Steel","Charlie Kenton is a washed-up fighter who retired from the ring when robots took over the sport. After his robot is trashed, he reluctantly teams up with his estranged son to rebuild and train an unlikely contender.","[""Action"", ""Science Fiction"", ""Drama""]","Shawn Levy","[""Hugh Jackman"", ""Dakota Goyo"", ""Evangeline Lilly"", ""Kevin Durand"", ""Anthony Mackie""]"
324552,"John Wick: Chapter 2","John Wick is forced out of retirement by a former associate looking to seize control of a shadowy international assassins’ guild. Bound by a blood oath to aid him, Wick travels to Rome and does battle against some of the world’s most dangerous killers.","[""Action"", ""Thriller"", ""Crime""]","Chad Stahelski","[""Keanu Reeves"", ""Common"", ""Ian McShane"", ""Laurence Fishburne"", ""Riccardo Scamarcio""]"
615656,"Meg 2: The Trench","An exploratory dive into the deepest depths of the ocean of a daring research team spirals into chaos when a malevolent mining operation threatens their mission and forces them into a high-stakes battle for survival.","[""Action"", ""Science Fiction"", ""Horror""]","Ben Wheatley","[""Jason Statham"", ""Wu Jing"", ""Shuya Sophia Cai"", ""Page Kennedy"", ""Sergio Peris-Mencheta""]"
397243,"The Autopsy of Jane Doe","Father and son coroners receive a mysterious unidentified corpse with no apparent cause of death. As they attempt to examine the ""Jane Doe,"" they discover increasingly bizarre clues that hold the key to her terrifying secrets.","[""Horror"", ""Mystery""]","André Øvredal","[""Emile Hirsch"", ""Brian Cox"", ""Ophelia Lovibond"", ""Olwen Catherine Kelly"", ""Michael McElhatton""]"
889737,"Joker: Folie à Deux","While struggling with his dual identity, Arthur Fleck not only stumbles upon true love, but also finds the music that's always been inside him.","[""Drama"", ""Crime"", ""Thriller""]","Todd Phillips","[""Joaquin Phoenix"", ""Lady Gaga"", ""Brendan Gleeson"", ""Catherine Keener"", ""Zazie Beetz""]"
954,"Mission: Impossible","When Ethan Hunt, the leader of a crack espionage team whose perilous operation has gone awry with no explanation, discovers that a mole has penetrated the CIA, he's surprised to learn that he's the prime suspect. To clear his name, Hunt now must ferret out the real double agent and, in the process, even the score.","[""Adventure"", ""Action"", ""Thriller""]","Brian De Palma","[""Tom Cruise"", ""Jon Voight"", ""Emmanuelle B\u00e9art"", ""Henry Czerny"", ""Jean Reno""]"
1079485,"Winnie-the-Pooh: Blood and Honey 2","Five months following the murders, Christopher Robin struggles to maintain a regular life while dealing with PTSD. However, deep within the 100-Acre-Wood, a destructive rage grows as Pooh, Piglet, Owl, and Tigger find their home and their lives endangered after their existence is revealed.","[""Horror"", ""Thriller""]","Rhys Frake-Waterfield","[""Ryan Oliva"", ""Scott Chambers"", ""Tallulah Evans"", ""Lewis Santer"", ""Marcus Massey""]"
974262,"Descendants: The Rise of Red","After the Queen of Hearts incites a coup on Auradon, her rebellious daughter Red and Cinderella's perfectionist daughter Chloe join forces and travel back in time to try to undo the traumatic event that set Red's mother down her villainous path.","[""Fantasy"", ""Adventure"", ""Family"", ""Comedy""]","Jennifer Phang","[""Kylie Cantrall"", ""Malia Baker"", ""Ruby Rose Turner"", ""Morgan Dudley"", ""Dara Rene\u00e9""]"
870360,"The Day the Earth Blew Up: A Looney Tunes Movie","Porky and Daffy, the classic animated odd couple, turn into unlikely heroes when their antics at the local bubble gum factory uncover a secret alien mind control plot. Against all odds, the two are determined to save their town (and the world!)...that is if they don't drive each other crazy in the process.","[""Family"", ""Comedy"", ""Adventure"", ""Animation""]","Peter Browngardt","[""Eric Bauza"", ""Candi Milo"", ""Peter MacNicol"", ""Fred Tatasciore"", ""Laraine Newman""]"
209112,"Batman v Superman: Dawn of Justice","Fearing the actions of a god-like Super Hero left unchecked, Gotham City’s own formidable, forceful vigilante takes on Metropolis’s most revered, modern-day savior, while the world wrestles with what sort of hero it really needs. And with Batman and Superman at war with one another, a new threat quickly arises, putting mankind in greater danger than it’s ever known before.","[""Action"", ""Adventure"", ""Fantasy""]","Zack Snyder","[""Ben Affleck"", ""Henry Cavill"", ""Jesse Eisenberg"", ""Gal Gadot"", ""Amy Adams""]"
245891,"John Wick","Ex-hitman John Wick comes out of retirement to track down the gangsters that took everything from him.","[""Action"", ""Thriller""]","Chad Stahelski","[""Keanu Reeves"", ""Michael Nyqvist"", ""Alfie Allen"", ""Willem Dafoe"", ""Dean Winters""]"
77338,"The Intouchables","A true story of two men who should never have met – a quadriplegic aristocrat who was injured in a paragliding accident and a young man from the projects.","[""Drama"", ""Comedy""]","Éric Toledano","[""Fran\u00e7ois Cluzet"", ""Omar Sy"", ""Dominique Henry"", ""Anne Le Ny"", ""Clotilde Mollet""]"
140607,"Star Wars: The Force Awakens","Thirty years after defeating the Galactic Empire, Han Solo and his allies face a new threat from the evil Kylo Ren and his army of Stormtroopers.","[""Adventure"", ""Action"", ""Science Fiction""]","J.J. Abrams","[""Harrison Ford"", ""Mark Hamill"", ""Carrie Fisher"", ""Adam Driver"", ""Daisy Ridley""]"
44833,"Battleship","When mankind beams a radio signal into space, a reply comes from ‘Planet G’, in the form of several alien crafts that splash down in the waters off Hawaii. Lieutenant Alex Hopper is a weapons officer assigned to the USS John Paul Jones, part of an international naval coalition which becomes the world's last hope for survival as they engage the hostile alien force of unimaginable strength. While taking on the invaders, Hopper must also try to live up to the potential that his brother, and his fiancée's father—an Admiral—expect of him.","[""Thriller"", ""Action"", ""Adventure"", ""Science Fiction""]","Peter Berg","[""Taylor Kitsch"", ""Alexander Skarsg\u00e5rd"", ""Rihanna"", ""Brooklyn Decker"", ""Tadanobu Asano""]"
985939,"Fall","For best friends Becky and Hunter, life is all about conquering fears and pushing limits. But after they climb 2,000 feet to the top of a remote, abandoned radio tower, they find themselves stranded with no way down. Now Becky and Hunter’s expert climbing skills will be put to the ultimate test as they desperately fight to survive the elements, a lack of supplies, and vertigo-inducing heights","[""Thriller""]","Scott Mann","[""Grace Caroline Currey"", ""Virginia Gardner"", ""Jeffrey Dean Morgan"", ""Mason Gooding"", ""Jasper Cole""]"
259693,"The Conjuring 2","Lorraine and Ed Warren travel to north London to help a single mother raising four children alone in a house plagued by malicious spirits.","[""Horror""]","James Wan","[""Patrick Wilson"", ""Vera Farmiga"", ""Madison Wolfe"", ""Frances O'Connor"", ""Lauren Esposito""]"
